url,appId,summary,developer,developerId,icon,score,scoreText,priceText,free
"https://play.google.com/store/apps/details?id=com.playjoy.app","com.playjoy.app","Multiplayer online games. At PlayJoy you can make new friends, chat and enjoy the best online classic games. Ludo, Bingo, Uno, Dominoes and many more.<br><br>•  BINGO. Do you like playing bingo? Enjoy the legendary multiplayer online bingo. Choose from different themed rooms and select the online bingo cards you want to play. Give bingo cards to your friends and win the jackpot of the best free bingo. Sign up for online bingo!<br><br>•  LUDO. The best free ludo from the original creators of online 2 dice game. Invite a friend to play ludo in pairs. Get all your pawns to the finish line before your opponents to win the game. Have fun playing free ludo with your family and friends or meet new people from all over the world in the largest online ludo community.<br><br>•  DOMINOES. Considered one of the most popular board games: easy to learn and difficult to master. PlayJoy dominoes is played in pairs. Prepare the best game strategy with your partner, place all your dominoes, score points and beat your opponents. Check the rules to learn how to play dominoes online.<br><br>•  UNO CLASSIC. The traditional Uno online game with friends, always exciting and fun. Play smart with your partner, run out of cards before your opponents and win the game. Maximum tension until the last play. Play Uno and enjoy!<br><br>•  VIDEOSLOTS. You can play online slots with different themes, bonuses and incredible graphics. We release a new slot machines every few days. Play for fun and enjoy the excitement of slots.<br><br>Many more coming soon! Write to us to vote for your favorite games.<br><br>--<br><br>CHAT NON STOP with the PlayJoy chat. Games designed to chat in private with your friends or in public rooms with people from all over the world.<br><br>PARTICIPATE IN THE RANKING and win prizes. Be the best in any game and get the best rewards.<br><br>COMPLETE CHALLENGES every day or week. All challenges have prizes!<br><br>GET FREE COINS every day. Beat your opponents or level up to get even more rewards.<br><br>GATHER YOUR FRIENDS. Send invitations via Whatsapp, Facebook or your favorite social network. Create your own list of friends so you can play online with them whenever you want or make new friends and invite them to play.<br><br>Note: play-for-fun games. The games do not offer &quot;real money gambling&quot; or an opportunity to win real money or prizes.<br><br>We want to hear your opinion. It&#39;s always a pleasure to hear from you! If you have any comments or questions, please write to us: support@playjoy.com","PlayJoy Games",N/A,"https://play-lh.googleusercontent.com/FLqhToLTLejX4YZz-xXVous3RvbXuttGr52InmiMm2WcLXdfZ222Vig0rAbg54sLsb4",4.1,"4.1",N/A,true
"https://play.google.com/store/apps/details?id=com.joycity.god","com.joycity.god","<font color=""#ff8c8c""><b>What is ‘Game of Dice’?</b></font><br><br><b>▣ Is This a Board Game or a Card Game?</b><br>- A board game like no other!<br>- Create your own strategy on the board with Dice and Skills!<br>- Play strategically to increase your territory and toll.<br>- Bankrupt opponents to win!<br><br><b>▣ Tons of Rewards and Awesome Benefits!</b><br>- Just log in for 2,000 Gems~<br>- 100 Free Draw Ticket for new Duelists as well!<br>- No more worrying about items! A Play Box with Gems, Gold, and Skills!<br><br><b>▣ Real-Time PvP Matches With Duelists Around the World!</b><br>- Duelists around the world, gather round~<br>- The board game for everyone that captured the heart of 50 million players!<br>- Compete with friends around the world through seasonal rankings and tournaments.<br><br><b>▣ Colorful Animation Dice!</b><br>- Robot Dice, Panda Dice, Devil Dice... Choose what you want and craft it!<br>- Enjoy the great animations of over a hundred Dice.<br>- Just play to gain Gems and get high tier Dice for free!<br><br><b>▣ Customize Your Deck With Skills!</b><br>- Select from over 200 Skills to create your own strategy for victory.<br>- Use various Skills like ‘Push’, ‘Drag’, and ‘Summon’!<br>- The beautiful illustrations within each Skill make the game more interesting!<br><br><b>▣ Over 100 Unique Characters!</b><br>- Watch the ‘Game of Dice’ animation filled with unique Characters.<br>- As well as the beautiful illustrations, there are cute SD characters within the game!<br>- An exciting betting battle with vivid Characters!<br><br><b>▣ Real-Time Solo Match &amp; 2vs2 Team Match!</b><br>- Come on pal! Let’s play Game of Dice~<br>- Show your teamwork with friends in a real-time 2vs2 team match!<br>- Meet new friends around the world through guild contents!<br>- If your friend is too busy, it’s time to play the solo mode!<br><br><b>▣ Various Contents That Never End</b><br>- Enjoy seasonal ranking, league tournaments, and guild match!<br>- Also, enjoy the exciting faction clash, limit tournaments, and odd number events every week.<br>- There are even more contents waiting to be updated :)<br><br><b>▣ Multiple language support</b><br>- English / 日本語 / 简体中文 / 繁體中文 / 한국어<br><br><b>▣ Community</b><br>- Follow us on our official communities to receive latest news and updates!<br>- Facebook : http://www.facebook.com/gameofdice.eng<br><br><b>▣ Customer Support</b><br>- Please contact our customer support(https://joycity.oqupie.com/portals/371) for any inquiries or comments<br><br><b>▣ Access Authorizations in JOYCITY Games</b><br>1. Access to Make and Manage Phone Calls<br>(When the game starts) It is essential to be able to identify the device for Guest Login (immediate start). Access to [Make and Manage Phone Calls] includes information to identify the device, and you will be unable to login to the game if you deny the access request. <br><br>2. Access to Contacts<br>(When logging into the game) It is essential to be able to identify the Google account registered in the device for Google Login. [Access to Contacts] includes information to read the Google account. You will be unable to login to the game if you deny the access request.<br><br>3. Access to Photos, Media, and Files<br>(When registering/editing profile) Access to [Photos, Media, and Files] saved in the device is required when you register/edit account profile image. Login and gameplay will not be affected even if you deny the access.<br>* Phrases used in [ ] may differ based on the device and OS version<br><br><b>▣ How to turn off app permissions</b><br>[Android 6.0 and up]<br>Device Settings &gt; Applications &gt; Tap the app &gt; Permissions &gt; Turn off app permissions<br><br>[Under Android 6.0]<br>It cannot turn off app permissions due to different operating system. Delete the app to turn off the permissions<br>* Terms used in the guide could be different depending on the device and OS version.<br><br>※ Game of Dice requires network connection for real-time matching.<br>※ This game is free to play, but you can choose to pay real money for some in-game items. Please note that some paid items may not be refundable depending on the type of the items.","JOYCITY Corp.",N/A,"https://play-lh.googleusercontent.com/BFgCidlCvcNcpJWpv-BtBBebPh2jHNSFCUW2b05Szn4tOJjcIb50q7wWAaurbCnF4FM",4.2426114,"4.2",N/A,true
"https://play.google.com/store/apps/details?id=com.tetrox.bowl","com.tetrox.bowl","Challenge your friends or play 1v1 matches with worthy opponents from all over the world. Bowling Crew is an excellent choice for bowling fans and a top-rated bowling game!<br><br>Switch between fascinating bowling balls to knock down all ten pins and get a strike! Win epic PvP-battles to gain rewards. Level up to win even more bowling matches and climb to the top of this free, fun multiplayer game.<br><br>Wargaming brings you legendary online multiplayer games to play with your like-minded friends.<br><br>Bowling Crew features:<br><br><b>INSTANT MATCHES</b><br>We will quickly find you a skill-appropriate opponent. Every match lasts no longer than 3 minutes. No more waiting – play online anytime, anywhere.<br><br><b>CHALLENGES</b><br>Test your skills on alleys with nonstandard rules every weekend. Show everyone how you&#39;re rolling!<br><br><b>SEASONS</b><br>Every week, you have an opportunity to participate in a competitive season with unique prizes. Win matches, gather tokens and collect season rewards!<br><br><b>FANTASTIC GRAPHICS</b><br>We take special care of graphics. Our breathtaking alleys will immerse you in a fascinating atmosphere of different settings, time periods, and moods.<br><br><b>AND MORE!</b><br>-revolutionary gameplay, which is easy to learn and difficult to master;<br>-millions of players who are waiting for a challenge;<br>-over 15 unique 3D bowling alleys and 120 striking balls;<br>-weekly leagues, where you can advance and get rewards;<br>-hidden easter eggs in every bowling lane – try to find them all;<br>-quick-fire real-time PvP multiplayer, which allows you to compete with the best bowling players;<br><br>Welcome to Bowling Crew! Compete with your friends for the &#39;KING OF BOWLING&#39; title. It is the first sports game by World of Tanks Blitz and World of Warships Blitz creators.<br><br><b>SUPPORT</b><br>In case you&#39;ve faced any issues or have some questions, do not hesitate to contact us:<br>E-mail support@bowlingcrew.com<br>Facebook https://www.facebook.com/bowlingcrew<br>YouTube https://www.youtube.com/BowlingCrew<br>Discord: https://discord.gg/Hb2w6r5<br><br>The game requires an Internet connection.","Wargaming Group",N/A,"https://play-lh.googleusercontent.com/N92NObUYvzXTETuP76gg9Dr8DJxGFcDYxBWCVNbWjxnKanJ2bd3UPkp43y5bUeha",4.576703,"4.6",N/A,true
"https://play.google.com/store/apps/details?id=com.bss.game.DicastRoc","com.bss.game.DicastRoc","Control chaos in a random world, Dicast! <br>Defeat the competitors around the world and become the best dice dominating Dicast of all! <br>Now, it is your turn! <br><br>New player support coupon! <br>Insert [DICAST10000] to get free $20 worth of 10,000 Gold. <br><br><b>■ NEW EXPERIENCE OF FUN</b><br>Simple, fast-paced, mix of strategy and randomness! <br>Not an ordinary monopoly type classic board game you’ve played. <br>Instead of selling and buying properties, set up your hero and base! <br>Roll the dice, attack your opponent to drain their HP and win the match! Get ready for RPG Dice battle! <br><br><b>■ UNIQUE STRATEGY</b><br>Combine your Hero with the powerful Base to find the best winning strategy! <br>Set up your own deck with Special cards to unleash amazing strategies! <br><br><b>■RULE THE CHAOS</b><br>Discover dice cards to control your destiny! <br>Decide where Hero to land and plan the moves strategically.<br>Fate of the game lies in your hands! <br><br><b>■CONSTANTLY EVOLVING</b><br>New Heroes, Bases, skins, special cards will be regularly be released!<br>Monster Jack Mode - Team up with 3 players to hunt the giant monster! <br>Hero Jack Mode – 4 vs. 4 team battle! <br><br><br><b><font color=""blue"">■GAME FEATURES</font></b> <br>-        Fight in real-time turn-based duels on board against players from across the world<br>-        Innovative battle system with dice-cards to control your moves  <br>-        Global and friendly rankings<br>-        Invite your friends to private battles <br>-        Unlock different worlds as you progress up the leagues<br>-        Aim for consecutive victories to earn Victory Keys<br>-        Unlock and collect new, mighty Heroes <br>-        Collect and unlock Special cards to build the ultimate deck<br>-        Upgrade your Base to unlock crafting system  <br>-        Participate in Monster Jack event with other players to defeat giant monsters!  <br><br>PLEASE NOTE! Dicast: Rules of Chaos is free to download and play, however, some game items can also be purchased for real money. If you don&#39;t want to use this feature, please disable in-app purchases in your device&#39;s settings. Also, under our Terms of Service and Privacy Policy, you must be at least 12 years of age to play or download Dicast: Rules of Chaos.<br><br>▣ Access Permission Guide ▣<br>We request access of [Storage] permission to use and save necessary files when providing the game services. <br><br>[How to change Access permission right]<br>▸ Android 6.0 and above: Settings&gt; Apps&gt; Advanced &gt; App Permissions &gt; Select Storage Permission &gt; On/Off Permission <br>▸ Under Android 6.0: Upgrade your operating system to revoke access or delete applications<br>※ If you are using Android 6.0 or lower version, you cannot set the optional access rights individually, so it is recommended to update to 6.0 or higher version.<br><br>Support: Having trouble? Contact us at game_support@bsscamp.com<br>Follow us on Facebook for tips and updates about the game! <br>Facebook: https://www.facebook.com/DicastRulesOfChaos","BSS COMPANY",N/A,"https://play-lh.googleusercontent.com/xll2xeP9XgF0OGJLBP4t5461ppna6834x9UJB2ckyGXee1Z4Q-t-4J6HzNxGk8G2Xw",4.257831,"4.3",N/A,true
"https://play.google.com/store/apps/details?id=com.talesupreader","com.talesupreader","<b>Be the hero of the story!</b><br>In Tales Up, you are the masters of your destiny. You decide which path to take, if you should trust that beggar who claims she can see the future, which one of you should give their life to save the others…<br><br><b>Discover unique adventures</b><br>Each adventure is unique! Want some conflict? Choose a Survival story! An ounce of magic? Choose a Fantasy story! Each story has artwork, a soundtrack and unique animations… and for those who don’t like overly-long stories, we’ve even got series!<br><br><b>Play the way you like</b><br>You decide, all the way! You can play in “tabletop” mode in a bar with friends,at a family dinner, with your colleagues. You can also play &quot;online&quot; to live adventures with whoever you want in the world or play on your own by controlling your team of adventurers!<br><br><b>Progression &amp; Collection</b><br>As you play our adventures, you can unlock others but also customize your avatar with different trinkets and goodies. For the more curious among you, you can find objects and titles by exploring secrets in the stories, and accomplishing missions!<br><br><b>Regular releases</b><br>New content comes out regularly: new stories, new objects, new characters.<br><br>We’re a small passionate team, and we hope you’ll have a good time!<br><br>You’ll need an Internet connection.<br><br><br>---<br><br><br>Tales Up is a cooperative roleplaying game, a blend of board game and interactive stories such as “choose your own adventure” books. It’s a very easy game to play, so it’s ideal while sharing a beer with friends!<br><br>You’ll find zombies, pirates, vikings… Hijinks and surprises will ensue!","Périple Studio",N/A,"https://play-lh.googleusercontent.com/Wo3CZ74nVO4VlxsdHdXME2FruSz2BogXCbbZWVuj6155stJptSJAmgXSar4Ij3KsH0Q",3.9333334,"3.9",N/A,true
"https://play.google.com/store/apps/details?id=com.exozet.android.catan","com.exozet.android.catan","Play the legendary strategy game ... anytime, anywhere.<br>Play true to the original board game rules, compete with up to four players for the most settlements, the longest roads and the largest army. Trade important resources, build roads and cities, settle the island and become Lord of Catan! <br>Prove your strategy skills by challenging other Catan fans online via cross-platform multiplayer, or take on the AI with various computer opponents, each with their own individual characteristics.<br>Become Harbormaster, discover new islands, invest new trade goods and defeat the barbarians, vanquish dragons or build a canal with the additional expansions.<br><br>Basic game features:<br>- Play according to the original board game rules<br>- Synchronous online multiplayer <br>- Smart computer opponents with individual strategies<br>- Comprehensive tutorial<br>- The Seafarers and Cities &amp; Knights LITE: Test the expansions in selected scenarios.<br>- Available languages: English, German, French, Dutch, Spanish, Portuguese, Japanese<br><br>Available expansions (in-app purchases):<br>- The Seafarers: Play your way through the elaborate campaign made up of 16 diverse scenarios and sail your ships to new shores.<br>- Cities &amp; Knights: Protect Catan from the barbarian invasion. New gameplay mechanics add even more variety to Catan.<br>- The new scenarios: Vanquish dragons or build a canal with the &quot;Enchanted Land&quot; and &quot;The Great Canal&quot; scenarios.<br>- The Islands: Discover uncharted lands with a collection of unofficial multi-island scenarios.<br>- All-expansions set<br><br>***** <br>Catan FAQ: <br><br>Question: Why do I have to download additional files after purchasing?<br>Answer: The download from Google play includes the basic game data and a tool that will determine your device’s display resolution and then download the optimal graphics data for your device.<br><br>Question: Which Android security permissions does Catan need and why?<br>Answer: “Storage” to write data to the SD or move the game data, “Network communication” to download game data and access the In App Store and “system tools” to check if Catan is already running to resume a game.<br><br>Question: I bought one of the expansions but after an update, reinstallation of Catan or after restoring my phone the expansion seems gone?<br>Answer: Don’t worry; your initial purchase is already saved in your Google account. However for technical reasons you might have to select “Buy” again. Confirm and a message will tell you that you’ve already purchased it. You will NOT be billed twice!<br><br>Question: I lost my campaign progress after reinstalling, updating from or when restoring my phone. Is there any way to restore it?<br>Answer: Savegames from old versions can usually be restored automatically. For all other cases we’ve integrated a cheat code: Enter campaign mode and go to select player. Enter „CatanWarp*“ (* = 1–15, e.g &quot;CatanWarp5&quot;) as your player name and confirm. Exit the game via the home button. Enter your phone’s settings menu. Select applications/manage applications/Catan/ and then “Force Stop”. Restart Catan. The campaign can now be continued from the specified level number by selecting “New scenario *”.<br>*****<br><br>*****<br>Suggestions for improvements and feature requests?<br>Mail to android@usm.de <br>We are looking forward to your feedback! <br><br>When contacting our support team, please provide details on the type of device and Android OS version used as well as a detailed description of the issue. Thank you!<br><br>For news and updates follow us on Facebook and Twitter.<br>*****","USM",N/A,"https://play-lh.googleusercontent.com/e2gT3SVCxXpdcolpok3saqaj4kYWGi5W0uFGcUbFkb4dEQ8qeJ_9gyeXMh0ay2EdXQ",2.6953568,"2.7",N/A,false
"https://play.google.com/store/apps/details?id=com.OPNeon.TCGCardTycoon","com.OPNeon.TCGCardTycoon","TCG Card Shop Tycoon is a trading card shop simulator games where you earn money and build your card shop tycoon business.<br><br>Upgrade your card store and collect rare cards as card collector! Start with a small card shop and expand into a super trading card business. Buy collection card packs, sell trading cards to become a rich tycoon.<br><br>💰 <b>SOURCE &amp; SELL</b><br>Buy your first pack of trading cards and sell them in this idle tycoon simulator game. Manage your money to stock up, upgrade card pack and make your business grow! Make important management decisions to build your empire and transform your small shop into one of the greatest in the world!<br><br>🏬 <b>BUILD YOUR CARD SHOP</b><br>Start with the basic racks and build a card shop you will be proud of. Order counters, shelves, create store names, restock your supplies, collect card, and more! Upgrade your shop and restock more card packs in this shop simulator games!<br><br>👨 <b>SERVE YOUR CUSTOMERS</b><br>If you like idle and tapping games, you will enjoy this casual card shop management game. Tap on the customer button faster to serve more customers and earn more revenue by selling card packs. For every 1000 packs sold, you get to open and add monster cards to your card collection! Be a card trader and collect all the rare cards in this collection games.<br><br>🎯 <b>GOALS</b><br>Check the TCG shop simulator goals and achievements to earn more rewards. From restocking levels and shelf unlocking to card collection challenges and shelf upgrades, these fun challenges will make our tycoon collection game even more fun!<br><br>📲 <b>FEATURES</b><br>- trading card shop simulator game<br>- casual and easy card collections<br>- amazing animations and 3D graphics<br>- build, upgrade and manage store<br>- collect all trading cards like TCG<br>- tap fast to serve more customers<br>- expand your card shop business<br>- dedicated card game shop to purchase upgrades<br><br>Now it’s time to play one of the most fun tycoon card shop simulator games!<br>👉 <b>Download Idle Card Shop Tycoon Simulator for FREE!</b><br><br>---<br>BY SIA DING SHEN<br>Idle Card Shop Tycoon Game is created by Sia Ding Shen, a recognized game developer who already created MegaBots Battle Arena and Dragon Merge Master - games played by millions of users worldwide.<br><br>Internet connection is required to play this game.<br><br>CONTACT:<br>If you have any queries regarding this trading card shop simulator game, please send them to opneongame@gmail.com. Till then enjoy playing the role of a card store manager and card collector in one of the most exciting shop simulator games of 2022.<br><br>SUPPORT:<br>http://www.opneon.com/support","Sia Ding Shen",N/A,"https://play-lh.googleusercontent.com/_wAMZMWt7GmpWxqr8oYcF1XySjMJYZPxydR-1L6Zdn9pM3TieFXlPDKKkHPzhyjEJCpi",4.4611454,"4.5",N/A,true
