url,appId,summary,developer,developerId,icon,score,scoreText,priceText,free
"https://play.google.com/store/apps/details?id=com.blizzard.wtcg.hearthstone","com.blizzard.wtcg.hearthstone","From the studio that brought you World of Warcraft® and Overwatch®, comes HEARTHSTONE®, Blizzard Entertainment’s award-winning collectable card game! Collect powerful cards and create mighty decks. Summon minions and sling a spell to seize control of ever-shifting battlegrounds. Wield a masterful strategy and outwit all players who dare challenge you.<br><br>Each card brings to life an extraordinary ability; use strategy to craft your deck and clever tricks to turn the tides of these PvE and PvP battles. Whether they’re minions, a spell, quests, or heroes, a Hearthstone card can dramatically change the duel with powerful effects and crazy interactions. Play as a clever rogue, a powerful mage, or any other of the game&#39;s ten Hero classes - they&#39;re all free!<br><br>Experience the magic, mischief and mayhem with your friends. Battle with friends and join the millions of players around the hearth to enjoy Hearthstone, and DOWNLOAD TODAY!<br><br>AN EVER-EXPANDING WARCRAFT UNIVERSE. Go into battle with your favorite Warcraft heroes like Illidan Stormrage, Jaina Proudmore and more. Explore iconic locations from the beloved Warcraft universe as you master your deck, collect cards, and assemble powerful combos, in this fast-paced card game of cunning strategy. Master the unexpected and seize control over the battlegrounds of Azeroth.<br><br>PLAY THE HIT GAME MODE HEARTHSTONE BATTLEGROUNDS. Invite your friends to play Battlegrounds with you, where eight heroes compete in a PvP auto-battler. The last one standing takes it all! Will you end up with the Battlegrounds crown?<br><br>MASTER AN ALL-NEW RPG MODE WITH  ROGUELIKE ELEMENTS: HEARTHSTONE MERCENARIES. Assemble and customize your dream team of iconic Warcraft characters. No need to build a deck, just grab your Mercenaries and jump into combat, choosing the right skills to help you vanquish your foes. Master an all-new RPG and engage in epic combat. Use your earnings to upgrade and equip your team of Mercenaries with the abilities and treasures needed to fight through roguelike maps and conquer an all-new combat system. As your Mercenaries progress, so too will their opponents, so use strategy to take on tougher, ever-evolving enemies. Which of your Mercenaries will earn their glory?<br><br>FEATURES:<br><br>HONE YOUR SKILLS: Practice in PvE adventures, face fierce competitors around the world in real-time PvP, and duel the strongest Heroes in the Warcraft universe. Jaina, Thrall, Uther, and Illidan, and more!<br><br>JUMP RIGHT IN: Fun introductory missions bring you into the world of Hearthstone’s intuitive gameplay, only a few seconds until your first duel!<br><br>DUEL EPIC HEROES, GLORY AWAITS: Defeat tough opponents around the world in real-time PvP, win and craft your deck using hundreds of unique cards – your collection grows with you in this CCG.<br><br>8-PLAYER EXPERIENCE: Are you ready to take your skills to the Battlegrounds? You and 7 other competitors take on the roles of familiar Heroes straight out of WoW history, craft powerful boards of recruited minions, and duel in this auto-battler until a single winner is crowned!<br><br>COMPETITIVE RPG MODE WITH ROGUELIKE ELEMENTS: HEARTHSTONE MERCENARIES: Discover new ways to play with this all-new RPG. Roguelike maps and seemingly endless team, treasure, and ability combinations make for a unique roguelike RPG experience with every battle. Say goodbye to building and balancing 30 card decks. Instead, choose which 6 Mercenaries you think has what it takes to take down your opponents and secure your bounties. Progress as you play to unlock new abilities and equipment that will make your Mercenaries more powerful and unlock new ways to fight!<br><br>© 2014-2023 Blizzard Entertainment, Inc. Hearthstone and Blizzard Entertainment are trademarks or registered trademarks of Blizzard Entertainment, Inc. in the U.S. and other countries","Blizzard Entertainment, Inc.",N/A,"https://play-lh.googleusercontent.com/qTt7JkhZ-U0kevENyTChyUijNUEctA3T5fh7cm8yzKUG0UAnMUgOMpG_9Ln7D24NbQ",3.905117,"3.9",N/A,true
"https://play.google.com/store/apps/details?id=com.tfgco.games.sports.free.tennis.clash","com.tfgco.games.sports.free.tennis.clash","🎾 Welcome to Tennis Clash: The Ultimate Online Multiplayer Tennis Game 🎾<br><br>Get ready to experience the thrill of the court like never before with Tennis Clash, the ultimate multiplayer online tennis game that&#39;s taking the sports gaming world by storm! Dive into the action with breathtaking graphics, realistic gameplay, and fierce competition – all from the palm of your hand. It&#39;s time to show off your racket skills and become the ultimate tennis champion!<br><br>🌟 Main Features 🌟<br><br>🎾 Tennis Clash: Experience intense tennis matches with players from around the world in a fast-paced, competitive environment.<br>🎮 Multiplayer Online: Challenge friends and rivals in real-time tennis duels, or compete in online leagues to reach the top.<br>🏸 Racket Customization: Upgrade and personalize your racket with a wide variety of unique designs and powerful boosts.<br>🏆 Sports Leagues: Join the global Tennis Clash community and climb the ranks by competing in seasonal leagues and prestigious tournaments.<br>🎓 Master Your Skills: Train and improve your tennis game with intuitive controls, customizable strategies, and advanced AI opponents.<br>💥 Stunning Graphics: Immerse yourself in the world of tennis with realistic graphics and smooth animations that bring the game to life.<br>🏁 Become the Tennis Clash Champion 🏁<br><br>Don&#39;t miss out on the ultimate online multiplayer tennis game that everyone&#39;s talking about! With Tennis Clash, you&#39;ll enjoy exhilarating sports action, top-notch graphics, and endless opportunities to prove your racket skills in the heat of competition. So, whether you&#39;re a seasoned tennis pro or just starting out, Tennis Clash has something for everyone.<br><br>Join the Tennis Clash league now, customize your racket, and experience the most realistic online sports game ever created. Step on the court, show your prowess, and become the ultimate tennis champion today! 🏆<br><br>Download Tennis Clash now and join millions of players worldwide in the most exciting online multiplayer tennis game on Google Play! 🎾🏸🌍","Wildlife Studios",N/A,"https://play-lh.googleusercontent.com/ArHDCyA6aG6x0mInq0iILzh6Yh7kuYsznszh6yhV6myY6HFrvOT5DeCcO9bk1pT08J6E",4.4134,"4.4",N/A,true
"https://play.google.com/store/apps/details?id=com.inforcegames.blackdeck","com.inforcegames.blackdeck","Fend off the forces of evil in ferocious card battles. Test your skills in combat and build your roster of heroes in this epic turn-based collectable card game with original core gameplay that’s <b> easy to learn but fiendishly difficult to master.</b><br><br><b>💥🔮FEATURES💥🔮:</b><br><br>🔥 <b>190+ beautifully designed cards</b> featuring fascinating characters from 10 different factions. Find and equip hundreds of powerful artifacts to improve your power.<br><br>🔥 Explore a stunning <b>fantasy world</b> with a beautiful map and over 300 stages.<br><br>🔥 <b>Fight the full gamut of evil forces in magic duels</b> ⚔️ with 48 Epic Bosses or enter the PvP arena to do card battle with other RPG enthusiasts.<br><br>🔥 <b>Battle your way</b> through 7 Dungeons featuring dangerous Titans to ensure you’re never lacking an exciting challenge.<br><br>🔥<b>Ascend the monster-filled levels of the Treasure Tower</b> with traps, powerups, and rich rewards behind every draw.<br><br>🔥<b>Cool artwork of compelling heroes</b> 🛡️ and fearsome foes, plus eye-catching animation to enhance your trading card adventures.<br><br>🔥<b>Myriad other enhancements and features</b> including autoplay to help you speed through campaigns, daily rewards to augment your trading card collection, and regular tournaments to challenge yourself against the world.<br><br>Dangerous monsters, undead hordes and terrible demons 👹 are on the rise! Only you stand between the massed forces of evil and the total devastation of this beautiful fantasy world. <br><br><u>Gather your heroes  and start your epic adventure in this turn-based RPG that’s guaranteed to thrill fans of strategic card games.</u><br><br>Privacy Policy: https://say.games/privacy-policy<br>Terms of Use: https://say.games/terms-of-use","SayGames Ltd",N/A,"https://play-lh.googleusercontent.com/kSgsL7EG5wo_E31pwC1jCgNrQ2Ut-bbOsdEePUX68yz2ATEVlU7FEJGCNK9nzolBVxY",4.0696006,"4.1",N/A,true
"https://play.google.com/store/apps/details?id=com.tapps.roguelike.rpg.cardguardians","com.tapps.roguelike.rpg.cardguardians","<h5><b>Welcome to the world of Valentia! Build your deck of cards and prepare for strategic CCG battles against monsters and the Guardians of Chaos.</b></h5> <br><br><b>Download FREE* Card Guardians:</b> embark on a <b>fantastic roguelike adventure game</b>:  win battles against monsters and build a card battle deck. <br><br>🔮 The Land of Valentia was at peace for thousands of years until the Day of Chaos came and spread mysterious magic that corrupted the living creatures of all realms. <br><br>☠️ Choose the hero of your RPG adventure, create CCG battle strategies, and discover various unexplored realms And beware of dangers! <br><br>✨ Download this card game to have fun in this RPG adventure, and discover a story of the epic war.<br><br>Become the master duel of the deck of card battle, and explore a roguelike world with dangers and epic stories!<br><br><h2><b>🃏 Card Deck Building RPG</b></h2><br><br>To free Valentia from the Magic of Chaos, you need the best deck of card battle. The more levels you advance, the more cards you get to build your RPG strategy. <br><br>As the hero, you have to build the best CCG card deck, set up battle strategies, and free all enemies overtaken by Magic of Chaos and threatening the peace of Valentia. <br><br>There are dungeons, castles, forests, and deserts that harbor dangerous enemies, with the difficulty of roguelike games.<br><br><h2><b>⚔️ RPG Strategy Battles</b></h2><br><br>Beware the Chaos Guardians!  At the end of each kingdom, you will encounter powerful bosses in the style of roguelike games, which will require the best card battle deck. <br><br>Explore your enemies&#39; weaknesses and build the best RPG strategy to achieve victory and unlock the realms.<br><br>A tactical error can spell your doom in this roguelike world. So, be careful to defeat your enemies, and earn new battles.<br><br><h2><b>🗺️ Medieval Kingdom Exploration</b></h2><br><br>The world of Valentia has kingdoms to be discovered. However, these kingdoms have unknown enemy species, dominated by Chaos Magic, and protecting various treasures, card battle, and equipment that will be important in your RPG adventure. <br><br>*Card Guardians: Deck Builder is a free offline CCG game. However, the card game has extra features and additional items that are optional for gameplay.","Tapps Games - PT",N/A,"https://play-lh.googleusercontent.com/I-e-8ZbWYSDbRLiVzc5zTX2J0YQ8ArNqGFxVxuFzAtDD2gPIM-JljJY28k5iGdsYwvY",4.513453,"4.5",N/A,true
"https://play.google.com/store/apps/details?id=com.topgolfmedia.android.tta","com.topgolfmedia.android.tta","You’ve been chosen to assemble an elite team of golfers to conquer courses the likes of which this world has never seen. Tee off on your own or compete head-to-head against other players as you level up and unlock new characters, imaginative courses and increasingly epic adventures!<br><br>BUILD YOUR TEAM OF LEGENDARY GOLFERS<br>Conquering boldly designed courses requires the best of the best. There are no weak links here. Need to hit a power shot? Select your pirate – so strong that the sea surrendered to him. Sometimes accuracy is the name of the game… Tag in your astronaut for out-of-this-world precision. Each golfer has their own unique skills and special abilities to help your team shine.<br><br>HONE YOUR GOLFERS’ SKILLS AND GUIDE THEM TO MASTERY<br>The more you play, the more you unlock for your golfers. Upgrade their abilities and equipment with collectible items on your journey to create a dream team.<br><br>CONQUER INCREDIBLE COURSES<br>A fearless squad like yours demands a challenge. Beyond the expected challenges of a golf course, reimagined hazards like active volcanoes, tornadoes, Turfkins (our sweet-looking but poorly behaved critters) and more, will keep you on your toes and put your abilities to the test.<br><br>TEE OFF SOLO OR GO HEAD-TO-HEAD<br>Choose to embark on an epic single-player campaign or go head-to-head against real-life combatants to see where you stack up against players around the world. Do you have what it takes to top the leaderboard? No matter what, if you aren&#39;t shanking your shots, you aren&#39;t trying!","WGT",N/A,"https://play-lh.googleusercontent.com/KQBfMcXuJHHAOfzrEuKb9iZnE4kWnMxGjseneXJpjg0idCodBxAoZtpjFH07Lvh_szY",3.368932,"3.4",N/A,true
"https://play.google.com/store/apps/details?id=com.sadpuppy.lemmings","com.sadpuppy.lemmings","Lemmings game is an offline classic puzzle game in which you have to guide the Lemmings in the right direction for their survival, build with tools and use commands to get them out of traps and puzzles to win missions.<br><br>Lemmings is a classic puzzle strategy game for those who love to play free survival games. There are thousands of levels available to enjoy the endless Lemmings fun. Lemmings are Crazy and run wild, they will run through the Lasers if you aren’t careful, you have to save the Lemmings by directing them in the right direction. You have to keep the Lemmings safe and away from the traps and obstacles to solve puzzles. You actually have to help the cute Lemmings in their death survival mission.<br><br>You can unlock various rewards, including new ways to overcome traps, new boosters and new Lemmings to add to your collections by progressing in this Lemmings puzzle game. We are frequently releasing new seasons and planets that contain levels, puzzle challenges and new uniquely designed Lemmings to use. Just download Lemmings puzzle offline, plan a survival strategy to survive the traps, to overcome hurdles and to get Lemmings out of danger. Your mission in this game is to keep Lemmings safe from the traps and hurdles by using different puzzle strategies in the game. It is very simple and easy to use survival tools in Lemmings.<br><br>How to play Lemmings puzzle game?<br><br>Each level in this classic puzzle game has a set number of Lemmings that spawn which you must direct to theobjective - an exit point. In order to get the Lemmings to that point safely you have to pass different traps, obstacles and puzzles. Lemmings aren’t very smart and will keep running through lasers and walls unless you guide and direct them by using your strategy to complete the Lemmings game missions. You need to be fast to set up your commands to turn them to an exit point and to save the Lemmings.<br><br>Initially it would be difficult for you to play the challenging missions in this Lemmings offline puzzle game, but by playing 1 to 2 missions it would become easy for you to help the Lemmings in getting them out of the dangerous zone.<br><br>Below are a few of the tools and commands that you can use in Lemmings survival:<br><br>Dig&gt; Dig through destructible blocks to pass cute Lemmings through them<br>Umbrella&gt; Slow down Lemmings fallings by using it and survive lemmings from death<br>Blocker&gt; Block Lemmings and make them turn away from the dangers, obstacles and traps<br>Staircase&gt; Build a diagonal staircase to get your Lemmings to higher places before their trapping and destruction<br>Destroy &gt; Sacrifice a Lemming to blow up and to destroy any built structure to move towards an exit point<br>Rocket &gt; Destroy blocks above your Lemmings for survival<br><br>XP System:<br><br>While you are playing through levels, you will earn Lemmings puzzle experience that adds up. Once you earn enough XP you will level up and be rewarded with various Lemmings boosters, tools for survival and special Lemmings for free.<br><br>Seasons &amp; Planets:<br><br>Every two weeks we update the game with either a new season or a new planet in this Lemmings puzzle strategy game for free. Each season comes along with 32 new lemmings for you to unlock along with some challenging missions. Each planet releases with new challenging levels. This means that you would always have more than enough challenges to accept and win in this Lemmings offline game","Exient",N/A,"https://play-lh.googleusercontent.com/dZW2hjy_9Zy0urXxHYNbrcBrD_d9AzSykfNJjp6N55Kl86YimTdInfmA3CHhPTHOIQ",4.312084,"4.3",N/A,true
"https://play.google.com/store/apps/details?id=com.direwolfdigital.sagrada","com.direwolfdigital.sagrada","Bring your stained glass masterpiece to dazzling digital life in Sagrada, the dice-drafting board game from Floodgate Games.<br><br>Take turns selecting colorful dice and placing them in your gorgeous stained-glass window. The artisan who creates the most beautiful window wins.<br><br>Choose your dice carefully!<br>Find the perfect fit for each piece of your window: restrictions on both the color and number showing on your die make for a puzzling challenge.<br><br>Use your tools!<br>As a master artisan, your tools-of-the-trade will help you shape the dice available.<br><br>Please your admirers!<br>Adapt to the fickle demands of your patrons -- while keeping your signature artistic flair -- for additional prestige.","Dire Wolf Digital",N/A,"https://play-lh.googleusercontent.com/Y_99leAZG2uWWy1DR4J6Qy4OQDL7zylZDnUPXgr4pnMFdEW-GXejnAGkvPiIwWw7O4g",4.46,"4.5",N/A,false
"https://play.google.com/store/apps/details?id=com.zeptolab.overcrowded","com.zeptolab.overcrowded","Do you like idle tycoon simulator games? Build the best theme park ever and become the roller coaster tycoon in the tycoon game from creators of Cut the Rope, C.A.T.S.: Crash Arena Turbo Stars, King of Thieves, and Bullet Echo. Enjoy this idle tycoon, build your theme park and become a carnival tycoon!<br><br>Manage your visitors’ emotions by constructing the most thrilling rides, tasty restaurants, and hiring the funniest mascots that your idle theme park has to offer. But watch out: your guests are very picky about their experience, so plan your strategy carefully!<br><br>- BUILD ATTRACTIONS: From bumper cars to the craziest coasters in the spirit of the rct classic games!<br>- MANAGE EMOTIONS: In this idle theme park tycoon, visitors can get sick (and puke), get hungry, angry, fall in love, and more!<br>- PROVIDE SERVICES: Where you place food stands, rest areas, and WCs all matter on your road to become a carnival tycoon.<br>- HIRE MASCOTS: Hire mascots to cheer up the angry or tired visitors.<br>- EXPAND YOUR PARK: Go bigger and wilder in this tycoon simulator!<br>- SPECIAL EVENT PARKS: Manage time-limited special parks with a unique theme and fresh gameplay and unlock exclusive attractions for your main park!<br><br>Design the most awesome theme park in the world in the best of idle roller coaster tycoon games! Your imagination is the limit!<br><br>Official Discord server of the game: discord.gg/overcrowded","ZeptoLab",N/A,"https://play-lh.googleusercontent.com/doMFfv9mNJpr5ZE8oa3Y9i4XejHpUzE4hgwd80vlKaNLa_0abMbWEgIwig3wQfneBg",4.01751,"4.0",N/A,true
"https://play.google.com/store/apps/details?id=com.glapp.solitaire","com.glapp.solitaire","Riddle Road - solitaire card game. The card game Riddle Road is a solitaire game with a captivating story and action. The card world of a solitaire, riddles, mysteries, events and adventures is waiting for you. Play our solitaire games improve your card skills, train your brain and have a lot of fun. <br><br>      🕹  Our casual, solitaire-style card game will immerse you in an amazing world of adventure, puzzles, mysteries and mystical events. A card game about adventures and mysterious events! Solitaire game where adventures will surprise the most demanding player! A huge number of levels, mini-games, plot twists - all this is available in a casual card game Riddle Road.<br><br>       Young journalist Abigail Fletcher is about to go on a huge adventure! Numerous locations, tricky mysteries, exciting stories of a small American town Oldbridge. Challenging puzzles, and new acquaintances - this is basically everything one could ask for! Tripeaks card game Riddle Road is a unique combination of classic solitaire and the world of secrets and mysticism. Grand solitaire is the best that can be in the card world of adventure.<br><br>      Join Abbie and uncover all of her family secrets, teach the villains en route a lesson or two, and follow closely all the plot twists! <br><br>Key features: 📣<br>Spectacular locations, magnetic characters, and loads of challenging tasks! You are about to fix the old lighthouse, restore an abandoned factory, solve the mystery of an old locomotive and what not! Play our Tripeaks solitaire card game and have fun. <br><br>    🃏   Our mobile casual card game Riddle Road will give you a huge number of different types of card solitaire: Card block solitaire, solitaire wheel of fortune, solitaire lift, tripeaks solitaire, color joker solitaire and many other species that you will learn as the game progresses. <br><br>   ♥  Play a huge number of exciting mini-games! Hidden objects, puzzles, passcolors, home decoration, repair and renovation of rooms, character dressing, labyrinth and riddles, cards and games and a huge number of secret mini-games that the player has to solve. <br><br>  ♣  Enjoy mini-games to your own taste! Hidden objects, find differences, and many other types of puzzles - that’s exactly what you need for a perfect break! You are certainly up to the challenge! <br><br>   ♦  Addictive solitaire levels with diverse mechanics - play one card up or one card down from your draw pile and you are all set for success!<br>     Don’t forget about powerful boosters that will make any tricky solitaire level a piece of cake! Clear the puzzle board with a few taps? Easy!<br><br>   ♠  Abbie can’t wait for you to join her on the adventure, solve all sorts of mysteries, and crack puzzles and solitaire levels on the way! Start your quest to become a true detective and a solitaire pro! Our card games are for lovers of solitaire and an amazing game story. Become a real detective with Abigail Fletcher. Investigate the mystery of the disappearance of her father&#39;s expedition. <br>        With the Riddle Road solitaire card game, you will get a lot of emotions from the passage of the story, become part of the Abigail family.","VIZOR APPS LTD.",N/A,"https://play-lh.googleusercontent.com/UOjSTLZ8d5X5RMQCKDe5WVtXoS5-GrqQbeUPTHYUSrEwUcz-jKp2zNfIHTWuW8Q26A",4.6754327,"4.7",N/A,true
"https://play.google.com/store/apps/details?id=com.tinyco.potter","com.tinyco.potter","A Wizarding World Adventure!","Jam City, Inc.","5509190841173705883","https://play-lh.googleusercontent.com/NR0W_2vMA7tQCVCgKCCapN7Xegp3oefnDDosDOclgRCFmUBjomb5gjg3V-3ycQp1QQ",4.456316,"4.5","FREE",true
"https://play.google.com/store/apps/details?id=com.nintendo.zaca","com.nintendo.zaca","Craft furniture and create your ideal campsite in Animal Crossing: Pocket Camp!","Nintendo Co., Ltd.","7277267556905944956","https://play-lh.googleusercontent.com/ipzcKtja-BDJc1I8WzwYK66W3P9ihIdfPQcKG2E6GkV5oYQRETE7W5dIi5zpTPp1Dg",4.361955,"4.4","FREE",true
"https://play.google.com/store/apps/details?id=com.playdemic.golf.android","com.playdemic.golf.android","Quick-fire golf duels! Master your golfing skills &amp; become the Golf Clash King!","ELECTRONIC ARTS","6605125519975771237","https://play-lh.googleusercontent.com/FeS75KKUsFYnPb67Uqj8Ob8DSWNf3-67KhxVxQnydKi2rNq2tqFhSY5bKx0wFXJN_1s",4.221743,"4.2","FREE",true
"https://play.google.com/store/apps/details?id=com.sonypicturestelevision.millionaire","com.sonypicturestelevision.millionaire","Play the original trivia game show! Who Wants to Be a Millionaire? for Android!","Uken Games","4698020563885400861","https://play-lh.googleusercontent.com/eghVvDUyIfsyflZGweoftI1oHW-wqfz8QidksgtAxCJgh9Ds42KoSNSpl_maa8obh487",4.5367665,"4.5","FREE",true
"https://play.google.com/store/apps/details?id=com.etermax.preguntados.lite","com.etermax.preguntados.lite","Answer fun questions and test your knowledge in this trivia game","etermax","4857484411335878422","https://play-lh.googleusercontent.com/flNnD5C6VBbITdFM8gGnqLoFiSrEP4Et5e3P0gdQl3T7o0znQdoNQruLF3TzZqneEzE",4.417096,"4.4","FREE",true
"https://play.google.com/store/apps/details?id=co.reality.getrent","co.reality.getrent","Property market simulator. Buy, manage and rent real places in your area.","Reality Games LTD","7729503051138227560","https://play-lh.googleusercontent.com/aHQ2Odc5vhR_dRMpkWJPxNA9mzc7ilcyN4E-N_Fk8TfsGpxk7JRvtS7rWbRN2SOPxQ",4.15688,"4.2","FREE",true
"https://play.google.com/store/apps/details?id=io.randomco.travel","io.randomco.travel","Merge &amp; Discover!","Magmatic Games LTD","4765571944833116862","https://play-lh.googleusercontent.com/81UIhEHuxTuySzoRYFZWQGhFxWFzaTz3GvEUqfO09GEtZ-MNxlIZ1GaicQra56Ja6I4",4.55875,"4.6","FREE",true
"https://play.google.com/store/apps/details?id=com.innplaylabs.animalkingdomraid","com.innplaylabs.animalkingdomraid","Loot treasure island coins to become the coin master of the raid game adventure!","Innplay Labs","Innplay+Labs","https://play-lh.googleusercontent.com/7KUX55iYZ5FA8Yw8MU3t-J4cPbRcafsZSuGzGhZIHy-K4ML8u9TRTMZjJr7ytG5gypA",4.7864633,"4.8","FREE",true
