url,appId,summary,developer,developerId,icon,score,scoreText,priceText,free
"https://play.google.com/store/apps/details?id=com.screenshake.dominodreams","com.screenshake.dominodreams","👑Welcome to Domino Dreams! Play this fun, free to play domino royal game created for Solitaire and Domino lovers and discover a new world in the most relaxing board game in the world! 👑<br><br>🏰Domino Dreams is a fun game for all domino and solitaire tripeaks lovers! Solve challenging domino puzzles and help King Richard on his royal tour adventure! Just play and relax while you enjoy the game&#39;s art design.🏰<br><br>👑Thousands of domino levels are waiting for you upon this grand royal journey of fun and excitement, for domino and solitaire players. Solve the challenging puzzles by finishing all your Domino bones in your hand, win coins and unlock new levels and new adventures along the way. Design, build, harvest the crops and decorate King Richard’s realm, with the help of his royal peon staff. The road ahead is surprising and full of wonders, be sure the drama will never end! 👑<br><br>📋Domino Dreams features: 📋<br>🏆 A unique dominoes experience!🥇<br>🏆 Play for free and win grand prizes!🎁🥇<br>🏆 Neverending levels of fun and excitement!🥇<br>🏆 Explore and harvest the royal kingdom and help make it greater than ever!🥇<br><br>🏰 Download now to accompany our beloved King Richard the 3rd, as he sets his mind to embark on a royal journey to tour his realm! Explore the kingdom and unlock more and more levels, grand challenges, and new worlds to build, crops to harvest, design and decorate. Take care of the royal kingdom’s towns, homes and gardens.🏰<br><br>👑Discover the royal game of dominoes - a new exciting way to enjoy the greatest board game in the world! Play to win coins and Gold Stars and fill up your royal treasury. 🎁 Help the king and his Peon team overcome challenging obstacles and make sure the quest is fit for a king. Harvest your success by using your domino money and prizes to design and build the kingdom and celebrate the love of the peon citizens for his royal highness, King Richard. 👑<br><br>🏰The challenging levels never end! Get bonus wild dominoes that will help you solve each challenge. 🥇 Improve and harvest your Domino skills and be the master of the board. Complete a series of moves to win the special streak bonus and receive rewards, boosters and more coins! All you need to do is to finish the Domino bones in your hand to become the winner! 🏰<br><br>👑Solve countless domino puzzles on this free to play domino game and keep unlocking more levels of fun and enjoyment for domino and solitaire lovers! The grand adventure awaits. Let your brain loose with this new neverending Domino game, download the game for free.👑<br><br>🎯Domino Dreams is free on all devices with in-app purchases.<br><br>🎯Follow Domino Dreams on Facebook for exclusive offers and bonuses!<br>https://www.facebook.com/DominoDreams/<br><br>🎯Are you having problems?<br>Please contact us via email at domino-help@superplay.co","SuperPlay.",N/A,"https://play-lh.googleusercontent.com/IlvMNytIffDUb4ZvVJbP5yz1q2tUS1A2tz2Hc60HixZC9KhVtaBqxRQWOX1Ky9yUAw7J",4.8142643,"4.8",N/A,true
"https://play.google.com/store/apps/details?id=com.superplaystudios.dicedreams","com.superplaystudios.dicedreams","<b>Welcome to Dice Dreams! <br>Join millions of players around the world! Roll the Dice on the magical board, Steal Coins, Attack your friends, build your Epic Kingdom and Embark on an adventurous journey! </b><br><br>🍿🍿The Legend Behind The Dice🍿🍿<br>Bob, the first of his name, returned to his kingdom after a journey visiting the Piggy King, only to find that his beloved home had been attacked!<br>Brave Bob decided to roll the dice and clash his enemies head on. He gathered his fellow peons, and together they went on an adventure to rebuild his kingdom, get revenge, and once again become the Kings of the hyper magical dice board game.<br><br>Will you help Bob and his friends on their quest to regain their throne as the Dice Dreams Kings? Will you travel through Peon Islands and other dreamy boards to bring them back to glory? <br><br>📋 Features: <br>🎯 Play for FREE with your friends and enjoy a variety of kingdoms. 🎯 <br>🎲 Join the action with players from around the world and play with your social network. <br>🎲 Steal from other boards and show them who&#39;s the Dice Dream King 😉 <br>🎲 Invite your Facebook friends to join the epic fun and become the master of the dice boards! <br>🎲 Protect your treasure and build the most magical kingdom! <br>🎲 Roll and play to collect cards by completing challenges and move up in levels!<br><br>🎯Roll &amp; Win🎯<br>🎲Go On and Roll the dice on the board, Win Golden Coins &amp; collect gems to build your kingdom, become the Dice King and master the dice board game! <br><br>Has your kingdom been attacked by a friend? It&#39;s time for revenge! Steal coins from them and upgrade your kingdom with the perfect bonus. Expand your kingdom by building more and making the Peons happy! Don&#39;t wait any longer, start building your kingdom and win amazing prizes!<br><br>🎲 Raid your enemies or friends. Just aim your slingshot, fire, and loot away! 🎯<br> 🎲 Earn gold by stealing from other kingdoms and making their treasure YOURS! <br>🎲 Get revenge on those who attacked your kingdom. <br>🎲 Become the master of the dice and help the Peons restore their kingdom! <br>You never know what treasures you can find in your friend’s kingdom. Attack and be surprised!<br><br>Get ready to go on an epic adventure with Dice Dreams!<br>Build your empire, attack your friends&#39; boards, and earn awesome prizes and coins! Will you be the master of the dice board game? With a variety of exciting challenges, there&#39;s always something new and thrilling to go for in Dice Dreams. So start building and become the ultimate Dice Dreams champion!<br><br>🎯Dice Dreams is free on all devices with in-app purchases.<br><br>🎯Follow Dice Dreams on Facebook for exclusive offers and bonuses!<br>https://www.facebook.com/DiceDreams/<br>🎯Are you having problems?<br>Please contact via email us at support@superplay.co","SuperPlay.",N/A,"https://play-lh.googleusercontent.com/IIGsWtdZWnn2-_ykp04KeAWsxHNJzLDaU-dxGc92cW9eUoNL5Yev5aR_yg-s4yBcM1dg",4.703374,"4.7",N/A,true
"https://play.google.com/store/apps/details?id=com.landlordgame.tycoon","com.landlordgame.tycoon","Landlord Tycoon is a thrilling real estate investment experience that puts you in charge of your own property empire. You can trade iconic US buildings. Buy and manage Empire State Building, Golden Gate Bridge, or even the Freedom Tower. With a unique premise and engaging features, it&#39;s a refreshing change of pace from traditional mobile games. <br><br>It is not just a mobile game, it&#39;s an adventure! With its geolocation feature, players can explore the real world and discover new properties to invest in. This unique gameplay encourages players to get up from their sofa, travel around, and have fun while building their property empire. Whether you&#39;re walking down the street or traveling to a new city, Landlord Tycoon&#39;s addictive gameplay will keep you engaged and entertained for hours. <br><br>The game&#39;s clean and well-designed graphics, coupled with its intuitive user interface, make it easy to learn and is recommended for all types of gamers. Not only is it a fantastic time-killer, but it also has excellent potential as an educational tool, allowing players to learn about property acquisition, profits, and losses in a fun and immersive way.<br><br>The 12-hour income system is a smart move that keeps you coming back for more, and the game&#39;s surprising entertainment value is addictive. The strategy-based gameplay is challenging yet rewarding, and the great potential and impressive features will keep you engaged for hours on end.<br><br>Landlord Tycoon has received praise from many reviewers for its good concept, enjoyable experience, interesting premise, engaging strategy, great graphics, and clean UI. It&#39;s a unique game that offers an exciting and immersive way to explore the world of real estate investment.<br><br>Whether you&#39;re a seasoned real estate investor or a newbie to the industry, Landlord Tycoon is a must-play game. It&#39;s one of the best strategy games available on mobile and a great way to pass the time. Highly addictive and fun, it&#39;s an excellent value for money and comes highly recommended by its users. Try it out today and start building your real estate empire!","Reality Games LTD",N/A,"https://play-lh.googleusercontent.com/DNjXPXzCVsbkPkKLW1noNLzcTmfrDw4XIj3kgG-9Jg-YGsPUyhhFWZYib-ehN3yOIYY",4.1781697,"4.2",N/A,true
"https://play.google.com/store/apps/details?id=com.scopely.wheeloffortune","com.scopely.wheeloffortune","Spin the wheel, solve puzzles and train your brain as you play the official Wheel of Fortune mobile game with family, friends and Wheel of Fortune fans everywhere! Challenge yourself to brand new puzzles every day!<br><br>Have you ever wanted to buy a vowel? Spin the Wheel with Pat Sajak? Guess letters and watch them appear on the iconic puzzle board? It’s WHEEL...OF...FORTUNE - based on the popular game show, and now you can be a contestant!<br><br>Jump into the Emmy®-winning TV game show you know and love because now it’s an addicting mobile game! Spin the Wheel, solve new puzzles written by the show’s producers, and win prizes. Challenge your friends and family through Facebook or play with millions of other players from around the world!	<br><br>Make it a daily habit and challenge yourself to new exciting puzzles and fun categories every day!<br><br>In Wheel of Fortune, Pat Sajak guides you on a fun-filled trip around the world with new puzzles from the hit TV game show! Play thousands of other fans, friends and family for a huge prize! The winner of these word puzzles will come out on top with the ultimate jackpot!	<br><br>==WHEEL OF FORTUNE FREE PLAY FEATURES==<br><br>Word Games written by the Producers!<br>- Guess on thousands of brand-new official word puzzles from the producers of the hit TV show!<br>- TV show host Pat Sajak guides you on a word game journey around the world, from New York and Paris to Tokyo and Hollywood<br>- New word games are added all the time. There’s always a new game show puzzle to solve!<br>- Fans of word games will have a blast solving each word puzzle with their friends!<br><br>Spin the Wheel &amp; Win! <br>- Prize wheel action is here – win big with Wild Card and or get lucky with Free Play...but watch out for Bankrupt and Lose a Turn wedges!<br><br>Classic Word Games with TV Show Flair<br>- Play classic word games just like the TV show! You’ll even get a selection of letters for spelling opportunities in the Bonus Round!<br>- Opt for a VIP All-Access Pass membership to get protection from Bankrupt and Lose a Turn wedges, and get lots of special perks!<br><br>Tournament Word Games &amp; Multiplayer Games<br>- Compete in word puzzle tournaments against other players online for huge prizes and unique collectibles! <br>- Play free word games with friends, Facebook friends and family as well as thousands of other players from around the world!<br>- Join game shows against thousands of players worldwide in free multiplayer word games, and have no delay starting a new puzzle game!<br><br>Spin the wheel, play free word games and solve word puzzles from America’s favorite TV game show by downloading Wheel of Fortune Free Play! <br><br><br>Privacy Policy:<br>http://scopely.com/privacy/<br><br>Terms of Service:<br>http://scopely.com/tos/<br><br>Additional Information, Rights, and Choices Available to California Players: https://scopely.com/privacy/#additionalinfo-california<br><br>Like Wheel of Fortune on Facebook!<br>http://www.facebook.com/TheWheelofFortuneGame/	<br><br>Questions? Comments? Chat with our Wheel of Fortune support team! wofsupport@scopely.com	<br><br>By installing this game you agree to the terms of the license agreements.	<br>Wheel of Fortune ® &amp; © 2018 Califon Productions, Inc. All Rights Reserved. Emmy® is a trademark of ATAS/NATAS","Scopely",N/A,"https://play-lh.googleusercontent.com/ccSTXd_TmmuenNyJXhfPSBc3SMNedNfr2BIo2vL_nRIX_dC4mzjmcHHECr_msUr0RQ",4.4511313,"4.5",N/A,true
"https://play.google.com/store/apps/details?id=se.maginteractive.wordzee","se.maginteractive.wordzee","You can train your brain as you make words, play with friends, and compete in different word games and word game modes in new Wordzee.<br><br>Show off your puzzle solving, spelling, and anagram word skills as you search for the best scoring word combination in this exciting, free, new, word game.<br><br>Wordzee is a new twist in word puzzle, anagram, and crossword games! It is free to play, and there are so many new words to make and ways to play!<br><br>Roll your word tiles like dice, build words and play them on the board to get the highest score as you connect with friends in thrilling matches. Play classic matches in order to try and win against other players by building the biggest word score and making a Wordzee! Can you fill all of the rows on the board with words of the correct length to get a huge Wordzee point boost to your score?<br><br>START PLAYING<br>Your new word puzzle game playing experience starts here! Start a new game with friends or family members who love word puzzles, dice games, and crossword puzzles. <br>Or you can start a classic match with a new opponent. <br>Shuffle the word tiles to find the highest scoring word on the board and play your move. Then it’s time for your opponent to try and find their best word to play. Why not start another game with a friend while they are playing!<br><br>PLAY WORDZEE AT FULL SPEED<br>Choose an instant game so you can play Wordzee in a quick game mode. Make words from the anagrams and play your tiles to get high scores with no waiting between rounds<br><br>IMPROVE YOUR SKILLS IN THE WORDZEE SOLO MODE CHALLENGES<br>Flex your word finding muscles in <b>Journeys</b>. Specially themed rounds let you explore and play your way to the top of the word map. Can your anagram and word puzzle skills get your word brain moving enough so you can complete the journey?<br>Play the <b>High Score</b> challenge and build the highest scoring words in a round to win exciting rewards. Play your best words to take your word puzzle game skills to the next level.<br>Can you make it to the top in the <b>Showdown</b> mode? Supersized tile values let you build huge scores against Kevin the Wordzee mascot. Use your word puzzle skills and play to win!<br><b>Totaliser</b> lets you build your score the more you play. The game is to carry on playing great words to get high scores, build totals, and win rewards! <br><br>CUSTOMIZE YOUR TILE STYLE<br>Show off your word game style and skills as you unlock special letter tiles like like the cute teddy bear, sushi, or watermelon<br>Special seasonal tiles mean your word games always look good<br><br>Love word puzzles and word games? Love Wordzee? Like us on Facebook or follow us on Twitter to stay up-to-date on MAG word game news, special contests, polls and lots of other fun stuff.<br><br>www.facebook.com/wordzeegame<br>www.twitter.com/wordzeegame<br>www.instagram.com/wordzeegame<br><br>Wordzee has been lovingly created by MAG Interactive, where we take fun seriously. We’ve made word games, puzzle games and fun social games on mobile for 10 years. Download Wordzee now!<br><br>Good Times!<br><br>Additional Information:<br>The Wordzee game is free to play. In-app purchases are available for additional content and in-game currency.","MAG Interactive",N/A,"https://play-lh.googleusercontent.com/csYZdKTrqLsMJ8_Kas2INtbcRL7V1ipUhqPE7BfU_xDMUnItiUEuNim_2CMiXWYolEQ",4.626698,"4.6",N/A,true
"https://play.google.com/store/apps/details?id=com.beachbum.domino","com.beachbum.domino","Let’s go play Domino Go! This classic, beloved tile-based game includes everything you adore about classic domino games, plus a few thrilling twists that make it even more fun to play. <br><br>And on top of it? It’s all resting in the palm of your hand, ready to turn every dull moment into an adventure you can share online with friends and loved ones. This game is fun to play and free of charge, anytime!<br><br>If you love playing classic games like Higgs dominos, checkers, chess, ludo, and backgammon — you’ve come to the right place! The most popular domino games: block dominoes, draw dominoes, or dominoes all fives await you! <br><br>Domino Go presents this classic game with a modern and unique mobile gaming experience. Domino Go stays true to the eternal elements of the original domino game, yet packs a punch of flavor and exciting animation, perfect for your Android device. After all, that’s what playing the dominoes game free is all about. <br><br>Want to learn more about the different Domino Go features? <br>Ready, steady, Domino Go! <br><br>Exciting graphics you have to see to believe: Realistic, fun visuals will make you feel as if the board game is right in front of you. Domino Go takes the game’s graphics to a higher level with colorful, immersive designs you’ll never get enough of. Enjoy multiple game skins, that come to life using capturing animations. <br><br>Beach Bum, the gaming leader that’s part of the global Voodoo Gaming family, invested countless hours in perfecting the Dominio Go gameplay. <br><br>No matter which Android device or version you own, you’ll appreciate the attention to detail and meticulous experience created in this online domino game. Coming soon -  multiplayer game you play with friends!<br><br>Have it all with multiple game variants: There are many different ways to enjoy a great dominoes game, and Domino Go covers them all. Choose between three games all wrapped into one. <br><br>You can play online block dominoes, draw dominoes, or dominoes all fives. You can also control the game length based on your mood and schedule. The rules are super easy to master, and clear, detailed tutorials are available for you to watch and learn. <br><br>Even if you’ve never played this incredible game before (what?!), you’ll figure it out in no time as soon as you download and play free dominoes.<br><br>Better together<br>What’s more fun than playing dominoes? Oh yeah, playing with others who love the game just as much as you do! <br><br>Create shared experiences with real dominoes players in real time. Win the game and feel like a dominoes champion! Soon-  playful chat features that allow you to communicate with other players and hang out with people online, joking and discussing the game (and anything else you have in mind).<br><br>Domino is a numbers game <br>Want to improve your online game and be proud of your progress? That’s what player stats and profiles are for! Understand the logic behind each game and learn how to get better and better. Thanks to this fun and helpful information, you’ll be winning every single tile game faster and sharing your statistics with others to establish your position as a dominos master among all other domino players.  <br><br>Let’s talk bonuses<br>Remember when we said this free online game has a few thrilling plot twists? Well, here they are! In addition to the classic, essential fun of traditional dominoes tiles, Domino Go offers lots and many bonuses for you to win. Collect an hourly bonus, and enjoy the classic dominoes game.<br><br>What are you waiting for? Go download Domino Go and start having fun playing this dominos online game. You don’t have to go very far. A world of excitement is waiting for you right here, just a tap away.<br><br>This game is only available to users of legal age. Winning any valuable items or money is not possible while playing this game. Additionally, your success in this game does not guarantee success in a comparable real-money casino game.","Beach Bum Ltd.",N/A,"https://play-lh.googleusercontent.com/2XovS1EkbMci3x7VjNRlDGYkiZpYgnwIrEva00KybKyjKZmkontgZdS7pFNiIOCueXtB",4.6553845,"4.7",N/A,true
"https://play.google.com/store/apps/details?id=com.daysofwonder.tt.android","com.daysofwonder.tt.android","CONNECT MORE THAN JUST CITIES!<br><br>Set off with your friends and family to re(discover) Ticket to Ride, the classic boardgame. In this railway adventure, you’ll need to be the quickest to link up your cities and reach your destinations. <br><br>In this strategy game for all ages, try out different tactics, block your competitors’ lines and take over routes before the others do. With so many different strategies to try, each new game is a unique experience.<br><br>Travel the world from Europe to India, passing through the legendary China, facing new challenges by purchasing additional maps with their own special rules (available in expansion packs).<br><br>- A tutorial teaches you the rules of the game so you can head off quickly on your adventure<br>- Play in single-player mode, online multi-player against the whole world, or local multi-player with your friends<br>- This is the official adaptation of Alan R. Moon’s best-selling boardgame, Ticket to Ride, which sold over 8 million copies.<br>- An easy-to-play strategy game<br>- No game is ever the same, you can play over and over again<br>- Discover a series of add-ons with special maps and rules<br>- Challenge players all over the world in cross-platform mode<br><br>You can follow us on Facebook, Twitter, Instagram and You Tube!<br>Facebook: https://www.facebook.com/TwinSailsInt<br>Twitter: https://twitter.com/TwinSailsInt<br>Instagram: https://www.instagram.com/TwinSailsInt<br>YouTube: https://www.YouTube.com/c/TwinSailsInteractive","Twin Sails Interactive",N/A,"https://play-lh.googleusercontent.com/rUvdj55YKFtbI4NYPx2Dk7rs6syXv1hTOVe2ESVyEOT1LZc-E_GvC1fLSC_a0WSRMigv",4.502864,"4.5",N/A,false
"https://play.google.com/store/apps/details?id=com.asmodeedigital.carcassonne","com.asmodeedigital.carcassonne","New version of the multi-awarded board game. Now in 3D. Includes improved AI, 3D landscape, new exclusive features.<br><br>*** Carcassonne fits that opening game niche that every game group needs. -Tyler Nichols, Board Game Quest<br>*** Carcassonne = Great game, great mechanics, great pieces, great fun! -The Board Game Family<br>*** Carcassonne&#39;s recent Android re-release and its fresh, new features are a joy to experience, whether you&#39;re playing against strangers online or testing friendships with existing pals - Pocket Gamer<br><br>A TILE PLACEMENT GAME OF CREATING LANDSCAPES, CLAIMING AREAS, AND GAINING POINTS<br>Discover or re-discover Carcassonne, the multi-awarded tile-based game in which players draw and place their tiles to build a medieval city. Place your cities, roads, abbeys or fields to enlarge your landscape, then place your followers, the meeples. Knights, robbers or farmers... Each meeple will help you control your territory and win points.<br>But be careful, you will need all your best strategy and tactics to maximum your points! Place your tiles and your meeples wisely to stop your opponents and win the game.<br><br>SIX EXPANSIONS: ENLARGE YOUR LANDSCAPE AND OPTIMIZE YOUR POINTS<br>Thanks to the mini expansions &quot;&quot;The River&quot;&quot; and &quot;&quot;The Abbot&quot;&quot;, you can embellish your landscape and vary your game to enjoy new ways to play! Double or even triple your points thanks to the new buildings in the Inns &amp; Cathedrals expansion! And with the Traders &amp; Builders expansion, score more points with the trading commodities and build faster with the builders! Discover the city of Carcassonne covered with a blanket of white snow in the Winter Edition... and look out for the Gingerbread Man and the bonus points he&#39;ll give you! Beware of the Dragon in &quot;&quot;the Princess and the Dragon&quot;&quot; expansion! He could eat your Meeples if you&#39;re not cautious. And be kind with the Princess: she might prefer you to other Meeples and toss them out of the cities!<br><br>FEATURES<br>• Accessible and tactical gameplay adapted from the award-winning Carcassonne board game    <br>• Six expansions:<br>- The River, the Inns &amp; Cathedrals, the Traders &amp; Builders and the Winter Edition expansions as well as the Princess and the Dragon expansion are all available to purchase from the Shop,<br>- And you can unlock The Abbot for free using your Asmodee account.<br>• Up to 6 players! Play against the computer in solo mode, face off your friends in Pass and Play or challenge players from around the world in online mode<br>• There is no more 3 but 4 different behaviors you can chose before starting a game with AIs. They all propose a better challenge than the previous ones. Players who want to experiment a true challenge will play against the Conqueror AI who is the strongest AI of the game.<br>• Try out the aerial top view to refine your strategy!<br>• Additional strategic layers compared to the physical version:<br>- field view which allows you to see the field possession of each player<br>- remaining tile list: allows you to see the tiles which are remaining in the draw pile<br><br>Languages available: English, French, German, Italian, Spanish<br><br>You can follow us on Facebook, Twitter, Instagram and You Tube!<br><br>Facebook: https://www.facebook.com/TwinSailsInt<br>Twitter: https://twitter.com/TwinSailsInt<br>Instagram: https://www.instagram.com/TwinSailsInt<br>YouTube: https://www.YouTube.com/c/TwinSailsInteractive","Twin Sails Interactive",N/A,"https://play-lh.googleusercontent.com/pBpKFQ7hs4E9TffxwrA7A3Ehqt37We53nyei5VaRPIRxRssQhHmaKRJBHNR5PhfqpAM",3.6465516,"3.6",N/A,false
