url,appId,summary,title,developer,developerId,icon,score,scoreText,priceText,free
"https://play.google.com/store/apps/details?id=com.hasbro.riskbigscreen","com.hasbro.riskbigscreen","Take over the world in RISK Global Domination, the iconic strategy board game.","RISK: Global Domination","SMG Studio","8648499208878745563","https://play-lh.googleusercontent.com/6CCG6Obo2ZazPyO64cg4qYMgF-bUl0THB4isIfoP2ByNUzpIT9J-vRlr786tIcV5Mho",4.43437,"4.4",N/A,true
"https://play.google.com/store/apps/details?id=com.nexonm.dominations.adk","com.nexonm.dominations.adk","Greetings Leaders. Ready to dominate the world &amp; battle through different areas of history? Engage in all out warfare in DomiNations! Build your empire &amp; command nations as you grow from a small village to a thriving metropolis, &amp; battle as one of the great civilizations from the history of the world<br><br>Base building meets the ultimate strategy game. Can you lead your army to victory? Defend your base from multiple nations &amp; embark on historic campaigns advancing through history. Each civilization, from the Romans to the Japanese Empire all have strengths &amp; unique units<br><br>Build your base to establish your nation. Start as an early settlement &amp; grow through the ages, from the dawn of history to the modern era. Study under history’s greats at the University, like Leonardo Da Vinci &amp; Catherine the Great. Build Wonders of the World &amp; create technology with historically accurate advancements. Build your base &amp; strengthen your defenses even further with the Council. Assign historical figures across time to your council, bolster attacks &amp; strengthen your base during war times with Councilors<br><br>The Drone Age has advanced with Drone Command, a new building that strengthens your strongholds &amp; your attacks to all enemy forces. Arm yourself &amp; defend against rival attacks with Defensive &amp; Offensive drones to carry out attacks automatically<br><br>Build your army, test your strategy against other players in PvP combat, or form alliances to conquer the world together in DomiNations<br><br>DOMINATIONS FEATURES:<br><br>BUILD YOUR BASE &amp; LEAD AN ARMY<br>• Build a base &amp; defend your nation <br>• Conquer the world as one of 8 fearsome Nations on its journey through time<br>• Choose one of the great civilizations from history like the Romans, British, Chinese, French, Germans, Japanese, Koreans &amp; Greeks<br>• Tackle historic battle campaigns, collect important resources &amp; upgrade your city as you advance through history<br><br>EPIC COMBAT IN EPIC WAR GAMES<br>• PVP combat awaits. Put your powerful Nation to the test<br>• Raid your enemies’ cities for loot<br>• Team up with other skilled rulers &amp; forge an unstoppable Alliance<br>• Unleash the full force of your armies with a battle strategy to outwit &amp; outlast your opponents in 50-on-50 Alliance warfare<br>• Conquer the globe in World War &amp; take home the spoils of war<br>• Resource management through the mechanics of war. Battle for untold wealth &amp; world domination<br><br>WAR GAMES: BATTLE FROM THE STONE AGE TO THE SPACE AGE<br>• Lead a colony of hunters &amp; gatherers on their conquest through the ages from the dawn of civilization to the modern era<br>• Design a small civilization &amp; grow it into a thriving metropolis<br>• Build historic Wonders of the World, like the Pyramids of Egypt &amp; the Roman Colosseum<br><br>DISCOVER NEW TECHNOLOGIES<br>• Research civilizations, materials, invent advanced weaponry &amp; develop trade to grow a bustling economy<br>• Through scientific discovery, reinforce troops with better equipment, upgrade buildings &amp; town center with modern materials<br><br>HISTORY GAMES MEET STRATEGY<br>• Work alongside History’s Greatest minds like Leonardo Da Vinci, Cleopatra, King Sejong, &amp; other trailblazers<br>• Develop your Nation with the greatest strategists known across the Ages<br><br>BRAND NEW EVENTS &amp; AGES<br>• Strategy games with limited-time goals based on events from history<br>• Collect rare rewards to help your Nation advance to conquer the world<br>• Upgrade your base &amp; your army with every age<br><br>Build one of history’s greatest civilizations &amp; develop a battle strategy to conquer opponents. Join an alliance &amp; achieve world domination in DomiNations<br><br>Download now to start building your civilization!<br><br>Application Permission Usage Notice:<br>We request access permissions to provide services as below<br>• Device ID &amp; phone calls: Identifies the relationship between device &amp; base<br>• Read, write on external storage: Capturing screenshots shared with customer service team<br><br>Privacy Policy:<br>https://bighugegames.com/privacy-policy/ <br><br>Terms of Service:<br>https://bighugegames.com/terms-of-use/","DomiNations","Big Huge Games, Inc.",N/A,"https://play-lh.googleusercontent.com/nN6V-gX9Zaue0vmql_gDlJ7JHj-MhVruLCk0gFcagaxIJ4F4BeLzKN3leX7kFqo4gw",4.072152,"4.1",N/A,true
"https://play.google.com/store/apps/details?id=com.vertexarts.riskywars","com.vertexarts.riskywars","Experience the most powerful implementation of the strategy classic!<br><br>Distribute your reinforcements and conquer enemy territories.<br>Fortify your sectors and secure bonus units round by round.<br>Earn trade cards and use their reinforcement boost to break through enemy lines.<br>Fight your way through the epic campaign or prove yourself in exciting custom matches.<br><br>Strategy, tactics and risk determine victory or defeat!<br><br>CAMPAIGN<br><br>• Complete great operations consisting of challenging missions<br>• Diverse mission objectives require customized strategies<br>• Complete all mission objectives to secure maximum rewards<br>• Achieve promotions and unlock upgrades<br>• Use powerful boosts to your advantage<br><br>CUSTOM GAME<br><br>• Play on the classic world map or unlock other great maps<br>• Adjust the game rules or play according to the classic rules<br>• Up to 5 computer opponents with adjustable levels of difficulty<br>• Compete against friends (pass and play)<br>• The harder the match, the better the rewards<br><br>OTHER FEATURES<br><br>• Interactive tutorial to all game areas<br>• Match statistics (territories, units, reinforcements, dice results, ...)<br>• Global game statistics (missions, custom games, dice results, ...)<br>• Optional fast forward computer turns<br>• Different zoom levels for a better overview<br>• Game state synchronizes across all devices and platforms<br><br>Stay tuned for more!<br><br>Subscribe on YouTube: https://youtube.com/VertexArts<br>Like us on Facebook: https://facebook.com/RiskyWars<br>Follow us on Twitter: https://twitter.com/RiskyWars<br>Follow us on Instagram: https://instagram.com/RiskyWars<br><br>https://riskywars.com","Risky Wars","Vertex Arts UG (haftungsbeschränkt) & Co. KG",N/A,"https://play-lh.googleusercontent.com/B_rrJMJBk69Mv6iDIIJ9AhRT8_YSOPqWQtHLNP5OZXQlBGILiA2geAXRcwIehJjr4A",3.97,"4.0",N/A,true
"https://play.google.com/store/apps/details?id=com.sillysoft.LuxDLX","com.sillysoft.LuxDLX","Lux DLX is an epic game of strategy, risk, conquest, and world domination! Featuring a universe of different maps and scenarios! Varied computer AI players that will challenge even masters! Hotseat multi-player on a single device! Plus lots of game options!<br><br>Lux DLX comes with a set of awesome maps for free:<br>Europe, USA, the UK, and the World are included!<br><br>100 more maps are available using the in-app unlock.<br>Mini maps designed to fit phone screens include:<br>- Australia Mini<br>- Brasil Mini<br>- British Isles Mini<br>- Castle Lux Mini<br>- China Mini<br>- Europe Mini<br>- France Mini<br>- Germany Mini<br>- Italy Mini<br>- Japan Mini<br>- Sweden Mini<br>- and more!<br><br>HD maps designed to fit tablet screens include:<br>- Canada HD<br>- Cascadia HD<br>- Franco-Prussian War HD<br>- King Arthur<br>- Napoleonic Wars HD<br>- Silicon Valley HD<br>- Spanish Civil War HD<br>- Vietnam War HD<br>- WWII Battles series<br>- and more!<br><br>Warning: this game has serious replay value!<br><br>TIPS:<br>- attack with 3 or more armies for best odds<br>- take over 1 enemy country per turn for a card<br>- fully eliminate an enemy and you get their cards<br><br>Lux DLX is a mobile version of Lux Delux,<br>available for Mac, Windows and Linux computers.<br><br>Wage a virtual war and conquer the world. <br>Risk it all, roll the dice, dominate and win!<br><br>&quot;Because taking over the world is fun!&quot;","Lux DLX (world conquest ++)","Sillysoft Games",N/A,"https://play-lh.googleusercontent.com/gnd-30o_9EauVQLtqfsObJ5u49fXZHUNbeE_pNmeVynaXbZhsd6uATMENp4sflAeSD0",3.4242425,"3.4",N/A,true
"https://play.google.com/store/apps/details?id=com.marmalade.battleship","com.marmalade.battleship","You sank my battleship!<br><br>The official version of the classic Hasbro board game of naval combat is now on mobile! Challenge other players in Classic Mode or in the all-new Commanders Mode - a fast-paced, strategic and tactical variation. Play with unique naval commanders and use resources to activate powerful special abilities that will secure you a win as you wage war on the high seas.<br><br><br>BATTLESHIP features:<br><br>CLASSIC MODE<br>- Faithful conversion of the classic board game<br>- Head-to-head combat<br>- Sink your opponent’s fleet before they sink yours<br>- Call your shot and fire!<br><br>COMMANDERS MODE<br>- BATTLESHIP with a twist!<br>- A brand new, more tactical variation of the game<br>- 3 new core abilities that shake up the strategic possibilities each turn<br>- Unique special abilities for each Commander<br>- New ship shapes to improve gameplay and the fun factor<br><br>COMMANDERS<br>- Battle with commanders from throughout the ages<br><br>FLEETS<br>- Each commander’s fleets feature unique and authentic art for each of the many warships! Watch as they come together in an epic clash of civilizations! <br><br>ARENAS<br>- Deploy your fleet to every corner of the world and battle in epic arenas inspired by historical naval battles!<br><br>MISSIONS AND RANKS<br>- Complete missions to earn medals, rank up and become the ultimate commander of the fleet! <br><br>SINGLE PLAYER<br>- Battle against AI Commanders and raise your game before heading into multiplayer!<br><br>MULTIPLAYER<br>- Take on a world of commanders all battling to have the last fleet standing and prove that you have what it takes to conquer the oceans!<br><br><br>Join us in BATTLESHIP now, and set sail for adventure, battle and glory!<br><br><br><br><br>BATTLESHIP is a trademark of Hasbro and is used with permission. © 2018 Hasbro. All Rights Reserved.","BATTLESHIP - Multiplayer Game","Marmalade Game Studio",N/A,"https://play-lh.googleusercontent.com/5HA9EImYH6_LyNX_Vb4OYoPa3g_NFCJ8KUeVPBKkYvYfrNzWVYEVZuVHc22hMxGmFPQ",3.9621212,"4.0",N/A,false
"https://play.google.com/store/apps/details?id=air.com.midjiwan.polytopia","air.com.midjiwan.polytopia","The Battle of Polytopia is a turn based civilization strategy game about controlling the map, fighting enemy tribes, discovering new lands and mastering new technologies. You take on the role as the ruler of a tribe and attempt to build a civilization in a turn based strategy competition with the other tribes. It can be played offline why the game is also suitable for traveling.<br> <br>With millions of installs, this game has  become a popular civilization style strategy games for mobile and it delivers a sleek user interface and depth in strategic game play.<br><br>FEATURES:<br><br>* Free turn based civilization strategy game.<br>* Single &amp; multiplayer strategy.<br>* Multiplayer matchmaking (Find players all over the world)<br>* Mirror Matches. (Meet opponents with the same tribe)<br>* Multiplayer Real time view.<br>* 4x (eXplore, eXpand, eXploit, and eXterminate)<br>* Exploration, strategy, farming, building, warfare and technology research.<br>* Three game modes – Perfection, Domination and Creative<br>* Diplomacy - Make Peace treaties &amp; Build Embassies<br>*  Invisible Cloaks and Daggers for Stealth attacks<br>* Wide range of different tribes with unique nature, culture and game experience.  <br>* Auto generated maps make each game a new experience.<br>* Allow offline game play.<br>* Player Avatars.<br>* Game play in portrait and landscape mode.<br>* Strategy multiplayer &amp; Pass &amp; Play.<br>* Leader board with top scores for the best civilization builders.<br>* Really Cute low poly graphics.","The Battle of Polytopia","Midjiwan AB",N/A,"https://play-lh.googleusercontent.com/YO8BbfRsuDk3pr_NqXQfvg4A3l6z6I0xSqR4GMy3mABs9twhdVbabGQ4tDi-yETQQ4c",4.4594793,"4.5",N/A,true
"https://play.google.com/store/apps/details?id=com.bairdhome.risk","com.bairdhome.risk","Just Risk It is a game of chance and strategy, similar to the classic board game of Risk. The goal is to gain territory by attacking your opponents, and eliminate them one-by-one. The last one remaining is the winner.<br><br>The latest release includes 25 unique missions that you can play. Each mission has specific challenges and obstacles that puts a twist on regular play. For example, one mission requires you to conquer at least one country on each round. Another mission has the computers forming a loose treaty and ganging up on you.<br><br>In free play mode, the game allows up to 6 players, which can be either human or computer. For the computer players, you can choose between easy, medium, or hard difficulty, where each one uses a different playing strategy.<br><br>This version has ads. For an ad-free version, please check out Just Risk It Missions. https://play.google.com/store/apps/details?id=com.bairdhome.riskmissions<br><br>For other great games by Sam Baird, check out Strategy (Stratego), Log Jam (Rush Hour), and Connect 4 (Connect Four).","Just Risk It!","Sam Baird",N/A,"https://play-lh.googleusercontent.com/GOUz6IumnEFtX1oEtZyeR79iqEKgKmxEv7RjRlclJOt459ciOAGpUEbdLpH5rNOGRLc",3.25,"3.2",N/A,true
"https://play.google.com/store/apps/details?id=com.teremok.influence","com.teremok.influence","This addictive strategy game with easy and cool Risk-based gameplay challenging your tactical and strategic skills!<br><br>Enjoy the ability to battle your friends, random maps, and clear interface: just imagine a spreading virus or warlord capturing new lands!<br><br><b>Maps, modes, and enemies</b><br><br>All maps are generated automatically and are unique in Influence. You can play on S, M, L, XL or XXL maps.<br><br>Unique modes are available for your fun game. There are darkness, symmetry, crowded, and unions!<br><br>Conquer in Influence up to four enemies. Every enemy can be from Freak to Master. It&#39;s up to you!<br><br><b>Statistics and Tops</b><br><br>You may view detailed statistics of your games including Duels and Tournaments. Raise the influence points and earn new levels to make it to the top.<br><br>Unlock unique achievements during special events or by participating in Tournaments.<br><br><b>Duels: Online multiplayer</b><br><br>Duels - online multiplayer face-to-face using the Internet. <br><br>Play several games simultaneously with your friends or anyone around the world. Compete in the global ratings using ELO system and earn new ranks.<br><br><b>Tournaments</b><br><br>Play unique hand-crafted maps in Weekly Tournaments or join intense battles in Daily Tournaments.<br><br>Winning in Tournaments yields up to 300% additional points and special medal.<br><br><b>Workshop</b><br><br>Create your own maps in Workshop, play maps created by other players ot replay maps from previous Tournaments.<br><br>You may also submit your maps to be included in Weekly Tournaments and unlock the special medal.<br><br><b>Multiplayer on one device</b><br><br>Play in Influence in a big party! Add your friends as enemies and compete with them on one device.","Influence","Teremok Games",N/A,"https://play-lh.googleusercontent.com/hLsmTdqyxwOolVbI42lyoAJs32WewFbfWbn7v3Gyy46vQPI633YpM_Nl71I7XQ8VH-k",3.4899497,"3.5",N/A,true
"https://play.google.com/store/apps/details?id=com.doradogames.conflictnations.worldwar3","com.doradogames.conflictnations.worldwar3","Modern Battle Tanks spearhead the assault, Attack Subs prowl the oceans for lone Carriers, Ace Pilots dominate the skies with Stealth Fighters… while your hand reaches for the Nuclear Launch Button. In Conflict of Nations: World War 3 you control the course of history on a global scale! <br><br>Take control of one of the mightiest nations of the world and face the looming threat of World War 3. Conquer resources, forge alliances and strengthen your economy. Research devastating weapons of mass destruction and risk it all to become the dominating superpower on the planet. <br><br>Intelligent alliances or ruthless expansion, stealth warfare or nuclear devastation? The choice is yours: The nation’s military power is awaiting your command - 24 hours a day, 7 days a week. Are you ready to take control?<br><br>For fans of realistic grand-strategy games, Conflict of Nations offers a gigantic playing field, a multitude of military units, and infinite paths to success. Jump into a match, plan your strategy, and lead your troops to victory in the days and weeks ahead. Rank up and claim your place among the best players in this addicting WW3 game.<br><br>FEATURES<br>✔ Up to 100 human opponents per match<br>✔ Units move in real-time across the battlefield<br>✔ Loads of different maps and scenarios<br>✔ Real military technologies and equipment<br>✔ Huge research tree with over 350 different unit types<br>✔ Three distinct doctrines: Western, European, Eastern<br>✔ Terrain based combat with stealth, radar and missiles<br>✔ Nuclear and chemical weapons of mass destruction<br>✔ Fresh content, updates, seasons and events <br>✔ Dedicated alliance gameplay in a huge community<br><br>Join the race for the best strategy players on the planet! Jump right into World War 3, and test yourself in real time against human players across geopolitical maps of the modern world!<br><br>Enjoy Conflict of Nations? Learn more about the game and share your experience with the growing community:<br><br>Facebook: https://www.facebook.com/conflictofnations/<br>Twitter: https://twitter.com/NationConflicts<br>Discord: https://discord.gg/by66wzg<br>Forum: https://forum.conflictnations.com/<br>Wiki: http://wiki.conflictnations.com/<br>Youtube: https://www.youtube.com/user/doradoonlinegames<br><br>Conflict of Nations: World War 3 is free to download and play. Some game items can also be purchased for real money. If you do not want to use this feature, please set up password protection for purchases in the settings of your Google Play Store app.","Conflict of Nations: WW3 Game","Dorado Games / DOG Productions Ltd",N/A,"https://play-lh.googleusercontent.com/G9F6g5dWNB6tLwpJ8UW1r9cbT2vluzd7Tywhwzhocls4qS-D9cIK2BmhMp7dTHWuElzw",4.3382506,"4.3",N/A,true
"https://play.google.com/store/apps/details?id=com.sandstormi.bloodhonor","com.sandstormi.bloodhonor","Wartime Glory is a turn-based strategy board game that is a perfect mix of classic war games like Risk with special cards that give it a new dimension of strategy and tactics.<br> <br>Special features of Wartime Glory include:<br>✔ Online multiplayer in real time against thousands of global players 🌎<br>✔ Trophies and rewards with every victory 🏆<br>✔ Practice mode against an incredible artificial intelligence 🤖<br>✔ Complete missions and special challenges for rewards 🎯<br>✔ Battle free-for-all or 2v2  🤝<br>✔ Fight in multiple maps based on historical battles of World War 2 (WW2) 🔁<br>✔ Axis and Allies factions as well as fantasy ones 🇺🇸🇩🇪🇮🇹🇬🇧🇯🇵🇷🇺<br> <br>Wartime Glory is a great WWII game if you are a war games or tactics games fan! Play it like so many other users and show us your fighting skills. Have you always loved playing Risk, are you tired of battleships, and do you have what it takes to face the toughest of challenges? If yes then show us, download this game and beat the best ones in countless battles! Wartime Glory is a multiplayer game about WW2 and military war strategy similar to Risk board game. An absolute must for you if you love tactics games, war simulator, or strategy games on the topics of war, conquer the world, military, missiles, or atomic bombs.<br> <br><b>War Strategy Games: Play military conquest, conquer countries and dominate the world in WWII</b><br>It doesn&#39;t matter if you are an experienced or inexperienced player, Wartime Glory is quick and easy to install. And once you have started the board game app, you will find that conquering the world is child&#39;s play. So you can leave the Risk board game in the closet. War is coming!<br> <br><b>Multiplayer game: Fight, conquer the world and conquer countries (War Simulator)</b><br>It combines classic Risk board gameplay and multiplayer games with an innovative deck of bonus cards for airstrikes, nukes, missiles, assassins and more. With different maps, game modes and options, and the possibility to play multiplayer games. Battleships are gone.<br> <br>Spend countless hours in Wartime Glory War Simulator. You will hardly find another board game app that offers as many options in the area of​​strategy games as this war game about World War II. You will quickly notice how exciting the board game app is and how much fun conquering the world and conquering countries is. You quickly notice the many hours of development that were invested in this high-quality war simulator in advance, so that the game became what it is today: one of the most popular games currently available in the &quot;Strategy War Games&quot; genre on the market. Download the war game today. Below are the most exciting features of our WW2 war game:<br> <br><b> Wartime Glory - Highlights of the Wargame</b><br>– World War II: war game with beautiful, illustrated cards<br>- Free War Simulator for everyone<br>- Team battles, rockets, nuclear bomb<br>- Multiplayer Games: Real-time online multiplayer game with integrated chat<br>- Auto save/resume offline games<br>- Personalized avatar and military troops skins<br>- Unique pattern colors to choose from in war game<br>- Turn-based leagues with rewards<br> <br><b>Strategy Games War - Play now at extreme risk in WWII</b><br>Download the war game and play against countless other players in the most exciting battles! What are you waiting for? Do you love multiplayer games and tactical games about military, fighting, and atomic bomb? Be one of the many users who also believe in Wartime Glory. You will see that the app will meet your expectations and give you countless hours of exciting play. So no more battleships - will you survive the battle, conquer countries, and even conquer the world? Show us your skills in fighting and conquering the world and become the winner in WW2. No risk, no fun!<br> <br>If you find a bug in our War Simulator war game, please support us and report it. You can email us at contact@sandstorminteractive.com. Thank you very much!","Wartime Glory - risk of WW3","Buldogo Games",N/A,"https://play-lh.googleusercontent.com/AD-YByD7I-OAg_GOH31ar6aYt6GGDMGzHKxWaxwXDc0YrTW_EmmCZ3505LP0jUwUiLA",4.052778,"4.1",N/A,true
"https://play.google.com/store/apps/details?id=com.scopely.monopolygo","com.scopely.monopolygo","ROLL for riches, BUILD your empire, DREAM big &amp; SCHEME your way to success!","MONOPOLY GO!","Scopely","9028773071151690823","https://play-lh.googleusercontent.com/KdmQVnmRGYfW-edH5YIq8s1AyzRspDgXoBWbTe9CnkmB1TMr2K5KlP7GIZ0hHDs-sd8",4.739875,"4.7",N/A,true
