url,appId,summary,title,developer,developerId,icon,score,scoreText,priceText,free
"https://play.google.com/store/apps/details?id=air.com.youdagames.google.ww.gop2MobileFree","air.com.youdagames.google.ww.gop2MobileFree","Texas Holdem Poker is the world&#39;s favorite online poker game. Now Play the best hold&#39;em poker on your Android offline, NO WIFI REQUIRED! Beat every cowboy in Texas, in this great &quot;Texas Hold em&quot; Poker app called Governor of Poker 2 !<br><br>Millions of poker players have enjoyed Governor of Poker, without an internet connection.<br>With an easy Texas Holdem Poker tutorial for players that don&#39;t know how to play Texas poker, but want to learn poker and good opponents for star poker players with real texas poker skills!<br>The poker chips you win with player Texas Holdem are required to buy houses, win transportation, play against advanced poker AI cowboys, win Texas and beat the new Governor of Poker.<br><br>TRY GOVERNOR OF POKER 2 FOR FREE, THEN UNLOCK THE FULL POKER RPG ADVENTURE IN THE GAME!<br><br>•Get ready for many hours and hours of Hold&#39;m Poker play:<br>- Over 80 challenging poker players to beat;<br>- 27 stunning casino saloons in 19 amazing Texas Holdem cities;<br>- Get hold of the five big poker assets.<br><br>•Amazing and Fun Texas Poker AI Engine:<br>The best poker engine will challenge poker beginners and world poker champions alike.<br>Refine your card tactics to match the countless holdm poker playing styles of your opponents and watch them go &quot;Steamy&quot; and Tilt after showing off your great card bluffs!<br>The offline Players will play better in each new city and poker tournament, no cheating allowed!<br><br>•Full Story and Progression:<br>Governor of Poker 2 starts where the first game ended.<br>A new Dallas government decided to put a ban on all Texas Holdem poker games and now considers the game to be illegal in Texas.<br>Take matters in your own hands and prove them wrong! Poker isn&#39;t a game of luck, but requires poker skill.<br><br>•Play Always and Everywhere Poker offline, no internet connection required:<br>There is no live internet connection required to play a good game of Texas hold&#39;em poker, you can just play Governor of Poker 2 offline anywhere you want!<br>Don&#39;t wait for real world players in multiplayer poker games, that don&#39;t respond or leave the pokergame or go all in every poker hand. Just play this singleplayer pokergame against realistic AI players!<br><br>•Customize poker characters:<br>Prove you are a big shot by customizing your poker style to fit your reputation. Vvisit one of the many great cowboy hat shops across Texas and get yourself the poker deluxe hat of your dreams!<br>The game includes HD Poker graphics for a great experience on all Android mobile devices: phones and tablets.<br><br>Travel through Texas by Train, Casino Boat or Coach and play poker whilst on your way to the next poker city in Texas.<br>Every city has lots of exciting cash games and big poker tournaments with even bigger Chip prizes, competition and bigger tournaments. You’ll experience more checks, calls, raises, folds and all-ins than you can imagine!<br>Enjoy sit-n-go tournaments, Wildcard tournaments, highstake poker, Cash games.<br><br>** NO WIFI CONNECTION REQUIRED **<br><br>Have you always been a Texas holde&#39;m pokee fanatic? You&#39;ll love Governor of Poker 2! What are you waiting for cowboy? Click install, download and prove you&#39;re worthy of the great poker title: GOVERNOR OF POKER !<br><br>**** Governor of Poker 2 Reviews ****<br>- Gamezebo: &quot;Makes poker accessible without being too simple. Great sense of personality. Excellent poker tutorial.. It&#39;s a Royal Flush.&quot;<br>- Jayisgames: &quot;Governor of Poker 2 is well-made, highly accessible, and surprisingly addictive for all kinds of players.&quot;<br>- Zylom: &quot;Play this challenging poker game now!&quot;<br>- Miniclip 5 stars out of 5: &quot;Howdy! Finally it’s here, Governor of Poker 2! Packed with lots and lots of poker extra’s! More cities to conquer and tournaments to play!&quot;<br><br>** NOTE:<br>This pokergame is FREE to play in Amarillo, but will require IAP to enjoy the full game.<br>Please contact support@youdagames.com if you have any issues or suggestions, we would love to help!<br>Facebook : https://www.facebook.com/governorofpoker2<br><br>Download Governor of Poker 2 now and enjoy the Texas Holdem Poker Adventure!","Governor of Poker 2 - Offline","Youda Games Holding B.V.",N/A,"https://play-lh.googleusercontent.com/Yn3f67mw_hXZHaswTI5adiiyONBTHo0XdwYzH1sEdFgbMWA2KkZHSIM2aR1zv6J_z9E",4.2460494,"4.2",N/A,true
"https://play.google.com/store/apps/details?id=com.youdagames.howtopoker","com.youdagames.howtopoker","<b>Learn how to play poker!</b> From an introduction to basic poker rules, to advanced poker tactics. <b>This handy offline poker tutorial app</b> explains the hand combinations, poker terms, hand rankings, winning hands, split pot, side pot and much more! It&#39;s Texas Holdem Poker explained in an easy way with clear instructions and lessons.<br> <br>Practice while you learn Texas Holdem rules! This poker trainer teaches poker dummies how to play poker, but also has great poker tips for advanced Texas Holdem online players. Can you spot the poker fish and the poker sharks at your table? You got to know when to holdem or foldem.<br> <br><b>This Poker Tutorial features:</b><br>● Poker game rules are explained.<br>● Instruction for beginners and advanced poker players.<br>● Clear tutorials on when to fold, how to bet and when to go all-in.<br>● It&#39;s easy to learn as it matches yahtzee rules.<br>● Quick rules on hands to play and when to fold.<br>● Instructions for All-in rules.<br>● Learn how split pot works.<br>● How does a side pot work.<br>● Betting rules and who will win in a poker showdown.<br>● Practice offline poker, no internet required, and get yourself ready for poker online.<br>● Tips can be paused, so you can read and learn poker at your own pace. You don&#39;t need to pause any video tutorial, you will learn it at the poker tables.<br>● Learn hand analysis, poker odds and probability.<br>● Included cheat sheet; a manual for poker hand ranking. Learn what beats what, in hand values.<br>● Learn how to bluff<br> <br>Be a poker star in a Vegas Casino! Install this great poker app now and learn Texas Holdem poker today! <br> <br>Note:<br>-This easy to use Android app is offered for free by the makers of the offline and online Texas Holdem Poker Game: GOVERNOR OF POKER!<br>- Suggestions or issues: support@governorofpoker.com<br>- Facebook: https://www.facebook.com/GOP3/<br>- Youtube: https://www.youtube.com/user/youdagames<br><br>Enjoy learning how to play poker for free, improve your poker skills and go all-in!","Learn How To Play Texas Poker","Youda Games Holding B.V.",N/A,"https://play-lh.googleusercontent.com/4olaH4k6edMGhxB5l4LZXp4HsAFNKZD5uvq2UkFLlwXXAlQeJn1fZu9ggSvf9sYGelg",4.13,"4.1",N/A,true
"https://play.google.com/store/apps/details?id=com.youdagames.pokerworld","com.youdagames.pokerworld","<b>Brought to you by the makers of Governor of Poker 3</b>.<br>Become the World Poker Champion - play the best free Texas Holdem poker around the world in the most famous poker cities. In this great offline and free poker game, you are battling and bluffing your way through several continents and famous poker cities. Ever played poker in Macau? Or visited the majestic Monaco casino? Or did you go all-in in the Bellagio in Las Vegas? This is your chance to play and become the best poker player in the world.<br><br>In <b>Poker World</b> you start your journey in the United States. By winning a series of tournaments, you progress and build up your reputation as a poker player. You will be able to join bigger and more exciting poker tournaments, get better poker sponsor deals and buy cool items to show off your poker status. Don’t be surprised to be challenged by the best poker players in the world. You can play heads-up against these World Top players and climb your way to the top.<br><br>PLAY POKER WORLD - SINGLE PLAYER POKER FOR FREE, SHOW OFF YOUR SKILLS AND BECOME THE WORLD’S BEST TEXAS HOLD&#39;EM POKER PLAYER IN THIS GREAT OFFLINE POKER ADVENTURE!<br><br><b>Great poker game features:</b><br>MORE THAN 30 HOURS of Texas Hold&#39;em Poker play<br><br>OVER 60 POKER CITIES in the world where you can participate in challenging poker tournaments. Every tournament varies in buy-in, number of players and poker winnings.<br><br>COLLECT STATUS SYMBOLS to build up your reputation in the poker scene and get access to certain tournaments.<br><br>WORLD TOP 10: beat all World Top players and win tickets for special tournaments.<br><br>PLAY ANYTIME, ANYWHERE: Poker offline, no internet connection required.<br><br>There is no internet connection required to play this great game. And one other big advantage: you don&#39;t have to wait for real world players like you do in live multiplayer poker. Slick, fast gameplay!<br><br>THE BEST AND MOST FUN POKER AI IN THE WORLD<br>This poker engine is created to give you the best poker experience and the feeling you are playing against real players. We made the AI to ensure the game is great for both beginning poker players who are learning poker and experienced players. Refine your play tactics and match the style to beat your opponents. The offline players will play better in each new city and poker tournament!<br><br>BIG FREE WELCOME PACKAGE: 20,000 free poker chips<br><br>MORE FREE CHIPS: Collect FREE chips every day with your daily bonus<br><br>EARN MORE CHIPS: Watch videos and earn free bonus poker chips in this poker paradise<br><br>GREAT HD GRAPHICS: The poker game is beautifully designed and includes HD poker graphics for a great poker experience. <br>Millions of poker players have already enjoyed our <b>Governor of Poker series.</b> Play this very exciting Texas Hold&#39;em game and prove you are the best poker player in the world. <br><br>Download this awesome poker game NOW and may Lady Luck be on your side!","Poker World, Offline TX Holdem","Youda Games Holding B.V.",N/A,"https://play-lh.googleusercontent.com/n9ZtVFSfZwd2Dabe67Z07lHzjPT9F0h8gGvgLZ5Z_AiZMzvu5haR56nflmCXRC5Cl_8",3.640625,"3.6",N/A,true
"https://play.google.com/store/apps/details?id=com.neowiz.texasholdem.poker","com.neowiz.texasholdem.poker","Whenever you want to play online Texas Hold’em with friends or tournaments, House of Poker is always open! <br><br>Play online video chat poker with friends and players all over the world.<br>Experience real poker night experience and make new poker friends now!<br><br>⭐ <b><u>Huge bonus chips and series of events await you every day!</u></b> ⭐<br><br>🏆 Online Multi-Table Tournament 🏆<br>Join the series of championship tournaments to collect rings and trophies!<br><br>🤫 Private tables 🤫<br>Invite your friends and throw a poker house party with group video chat.<br>Online Poker nights just become so realistic. <br><br>♠ Join the league ♠<br>Play any game, and you’re in! Show your Poker skills and get larger benefits!<br><br>♥ Card collection ♥<br>Complete cards sets every season and claim huge bonus chips!<br><br>♦ Poker Tournaments ♦<br>Play against other players and become a winner!<br><br>😍 <u>Here are more reasons you must play Texas Holdem Poker : House of Poker!</u> 😍<br><br>✅ The REALIST Texas Holdem Poker - Play No-Limit Texas Holdem to boost your bankroll! <br><br>✅ Thrilling tournaments - Chase the thrill of Sit&amp;Go and Shootout poker tournament!<br><br>✅ Time bonus every 30 minutes – Don’t forget to collect free poker chips! Bonus rate goes up whenever you come back!<br><br>✅ Complete missions today and get a boost for tomorrow’s mission rewards!<br><br>✅ Participate in limited time events and get free chips!<br><br>✅ Fair hands guaranteed – House of Poker is RNG certified. Play fair poker hands every time!<br><br>✅ Multiple Language - Play against players from all over the world!<br><br>Want more than Texas Holdem Poker? You can play your favorite casino games for free in House of Poker!<br><br>Play Texas Holdem Poker, Blackjack 21, Free Slots, and Video Poker at your fingertips!<br>Enjoy the realistic online Las Vegas casino experience!<br><br>🏆 <font color=""#ff0000"">Blackjack 21</font><br>Bust the dealer then everyone wins! Dive into the real-casino vibe and hit the big time!<br><br>🎰  <font color=""#ff0000"">Slots</font><br>The greatest collection of classic slots and video slot machines. New slots are also coming soon!<br><br>🌟  <font color=""#ff0000"">Video poker</font><br>Play multiple hands in classic Jacks or better!<br><br>The best free online Texas Holdem Poker, House of Poker, looks forward to any questions or comments from you.<br>hop_support@massivegaming.io<br><br>Texas Holdem Poker : House of Poker is only available to people of legal age.<br>Texas Holdem Poker : House of Poker does not offer real money gambling or an opportunity to win real money or prizes. <br>Practice or success in playing this game does not imply your future success at casino or real money gambling.","House of Poker - Texas holdem","MASSIVE GAMING PTY LTD",N/A,"https://play-lh.googleusercontent.com/PtFN0tc7cTNq751nodjiFcC5RCwrc92LjAPWH2isbpenSdGi6O3LvkTIZcPHFGRFdw",4.267157,"4.3",N/A,true
"https://play.google.com/store/apps/details?id=com.forevernine.texaspoker.android","com.forevernine.texaspoker.android","Infiltrate a sinister new-age Holdem Texas casino syndicate and overcome the odds to become the world&#39;s greatest Poker Shark!<br><br>Prepare to play as Ben, the protagonist, whose life has come knocking on his door as he learns of his uncle&#39;s mysterious disappearance 30 years after he left his family.<br><br>As he enters a modern underworld ruled by the world&#39;s wealthiest, most powerful, and cunning Poker Lords, he must not only learn the art of survival but also learn the best skills of Texas Holdem Poker from his new mentor.<br><br>And this is how your story begins in familial land of power and wealth. But keep in mind that there&#39;s no going back, and your life will never be the same again.<br><br>Play the most engaging social Poker game - Holdem or Foldem! Compete and challenge real Global Poker Pros and move up the Leaderboard to fame. Battle in various real-time poker tournaments, with real people, and collect big bonuses.<br><br>♠♣♥♦ GAME FEATURES ♦♥♣♠<br><br>♠ FREE CHIPS: Enjoy playing all the time with FREE Chips options every few hours! Including, 1,000,000 FREE CHIPS when you download! Free chips mean free poker!<br><br>♣ FAIRPLAY GUARANTEED, EVERY TIME: Holdem or Foldem is officially licensed to provide an experience of a real poker table game. Play anywhere, with experience, as well as an assurance of a real social casino.<br><br>♦ UNIQUE STORYLINE: Enjoy playing Holdem Poker, while being part of a creative, deep and highly imaginative storyline unlocking new secrets, objectives, and checkpoints.<br><br>♠ REVOLUTIONARY PORTRAIT POKER: Texas Holdem or Foldem offers modern and comfortable gameplay in Portrait Mode so you can play your favorite poker game anywhere, with convenience.<br><br>♣ MULTIPLE TOURNAMENTS: Join the most popular offline Poker tournaments. Play faster cards at the iconic nine-person table or the modern five-person table. Free Texas Holdem poker has something for every playing style.<br><br>♦ POKER WITH FRIENDS: Invite friends to join your table and together defeat other players. Playing live games with friends unlocks more fun and bigger prizes as you get FREE rewards with every invite. Enjoy free poker collectively.<br><br>♠ MINI-GAME SLOTS: Spin and win BIG poker chips in between poker hands with our casino slot machine. With Holdem or Foldem, challenge your luck, not just people.<br><br>♣ EXCLUSIVE DAILY EVENTS: Check out Holdem or Foldem daily for more intense, amazing, and exclusive poker content. More poker tables, poker hands, poker challenges, poker card bonuses, FREE chip events, and much more! Experience this Texas Holdem Poker game free online!<br><br>♥ CONNECT WITH FACEBOOK: Connect with your Facebook Account to win extra FREE 1,000,000 Chips, keep your Account safe and enjoy playing with your Facebook friends and continue to experience Free Texas Hold’em poker.<br><br>♠ VIP PROGRAM: Earn more in-game benefits, features, and rewards by reaching higher Tiers of our VIP Membership. Enjoy exclusive chip and diamonds Discounts &amp; special poker game Modes.<br><br>Holdem or Foldem is the new one-stop destination for Table Top poker players, video poker players, Texas Poker fans, and Social casino lovers. If you cherish Vegas, Texas, Macau, or Monaco casino experience, you will feel right at home with our global poker community. Enjoy poker player statistics, hand strength info, amazing animations!<br><br>Download Texas Holdem or Foldem and start playing today for FREE! The classic free poker casino card game, now for Mobile and Tablets! Take your Free Holdem Poker everywhere.<br><br>Facebook: https://www.facebook.com/gaming/hof.tp.nine<br><br>This product is intended for use by those 21 or older for amusement purposes only.<br>Practice or success at social casino and poker gaming does not imply future success at real money gambling.<br><br>This product does not offer real money gambling or poker or an opportunity to win real money or prizes.","Holdem or Foldem - Texas Poker","Forever9 Games",N/A,"https://play-lh.googleusercontent.com/-otCQzHJgU-fRkntxz2nEngNJrGYarcwbbCX60R68CT2AVwqyU81zOcH8aa3HQSCTg",4.1557503,"4.2",N/A,true
"https://play.google.com/store/apps/details?id=com.wonderpeople.megahitpoker.global","com.wonderpeople.megahitpoker.global","Play Texas Holdem Poker Online against millions of players all around the world and prove your mega poker skills!<br><br>Mega Hit Poker is designed to offer the BEST POKER EXPERIENCE POSSIBLE in a hand held device! Become a Champion in our Top Player Mode and prove that you are better than the rest! Are you up for the challenge? Play now and find out!<br><br>Features<br>● FREE CHIPS - Get LOADS of free chips just by logging in! Play poker and win big!<br>● CROSSPLAY - Enjoy Mega Hit Poker on all devices! PCs, Tablets, and Mobiles and even Smart TVs!<br>● MASSIVE ONLINE TOURNAMENTS - Compete with UP TO 1,000 PLAYERS in real time! Win and prove that you are the true poker master!<br>● WEEKLY LEAGUE - Win the most chips during the league to be on top of the chart and win huge prizes! You are automatically participated just by playing Poker!<br>● VARIOUS GAME MODES – Cash Games, Sit &amp; Go, Shoot-out, and Tournaments. All kinds of Texas Holdem Poker! Don’t forget about the special game modes we have as well!<br>● VIP BENEFITS - Reach high Levels in our VIP memberships and earn various in-game benefits such as exclusive chip package offerings! You can get VIP points just by playing poker!<br>● NO LIMIT HOLDEM - Play big, win big! Real Texas Holdem poker players are never afraid to go all-in.<br>● PLAYER RECORDS - Check your play history to improve yourself or check others to find out their play patterns to beat them!<br>● SOCIAL FEATURES – Connect your Facebook Account to the game to get a handsome reward! Being able to safely secure your account is a plus!<br>● SLOT MACHINE – Bored at the poker table? Don’t worry! Hit the SLOTS while you’re waiting!<br>● TOP OF THE SHARKS – Are you a Shark? Can you spot out the fish? Prove to the rest that you are better and mark your name in the Hall of Fame!<br>● VARIOUS EVENT SALES PROMOTION – Interested in our chip offerings? We’ve got you covered! Enjoy the various sales promotions we have going at ALL TIMES!<br><br>RNG Certified<br>The card shuffling algorithm used in Mega Hit Poker has been tested and certified by iTech Labs! You can check the certification by going to the in-game settings menu! Mega Hit Poker supports fair game play!<br><br>We are happy to hear your voice! Come find us at Facebook Page(http://bit.ly/MHP_Fanpage) or send us a ticket via the in-game CS feature!<br><br>It’s time to play Texas Holdem poker! Hit the tables and show them what you’ve got!","Mega Hit Poker: Texas Holdem","Wonder People Co.,Ltd.",N/A,"https://play-lh.googleusercontent.com/ZeB93ayIK8b90mb1WhdSfjisGHyfI7ZJeuiJWW8p5Flyen5acmNOnjuSv79p460vV3c",4.4845567,"4.5",N/A,true
"https://play.google.com/store/apps/details?id=eu.ganymede.pokerhd","eu.ganymede.pokerhd","<b>Play FREE Texas Holdem and Omaha Poker Games at Poker Live Pro – the latest poker app by GameDesire!</b><br><br>Enter the world of free, online poker! Join Poker Texas Holdem Live Pro to feel the thrill of real entertainment! Advance with your poker chips and buy into high-stakes poker tables. Compete against the best poker players and prove you’re a true poker star!  Poker Texas Holdem Live Pro invites you to join adrenaline-filled poker tournaments and single-hand battles as you bluff, bet and win with your poker hand.<br><br><b>Additional Features to Enhance your Poker Experience</b><br><br>★<b>Professional</b>: Extensive poker stats, poker table variety, true multiplayer experience.<br>★<b>Reliable</b>: Similar high-level poker game experience on all platforms and devices.<br>★<b>Progressive</b>: Very generous poker tournament offerings with a supportive bonus system.<br>★<b>Incredible Design</b>: Top-of-the-line visual interface, creating a very slick poker game design.<br>★<b>Game-Aspects</b>: Multi-tabling poker strategy possibilities coming soon!<br><br><b><u>Play Poker Texas Holdem Live Pro –  The BEST FREE POKER experience on all devices!</u></b>  <br><br>Step into the Poker ring with the masters! Whether you just started to play or you’re already a poker combinations superstar, Poker Texas Holdem Live Pro suits all levels. In this Texas Holdem poker game, you will be able to start your poker journey at the stake level of your choice.  <br><br><b>Use our Happy Hour Bonus and cash in on your poker-winning hands</b><br><br><b>Put on your Poker Face and start playing</b><br><br>Play like the pros with a large variety of poker rooms and top-of-the-line poker tournaments. Get ready to play anytime with thousands of online poker players.  With our Welcome Poker Bonus and Free Daily poker chips, you will never wait to play! Poker Texas Holdem Live Pro is full of jackpots, special bonuses and achievements – so you can start-off small and gradually improve your Texas Holdem poker rankings!<br><br><b>Cash-in on Poker Bonuses!</b><br><br><b>True Multiplayer Texas Holdem Poker card game</b><br><br>Challenge your friends to a card game or play against any of the thousands of worldwide poker stars. You can invite other poker players to your poker table, chat with them and exchange poker game strategies. With cash tables in a range of amounts and daily poker tournaments, you will feel the exciting rush of going All-In!<br><br>Texas Hold’em Poker games come to life with Poker Live Pro by GameDesire™ - the most professional poker app you’ve ever played!<br><br>The game is intended for an adult audience.<br>The game does not offer &quot;real money gambling&quot; or an opportunity to win real money or prizes.<br>Practice or success at online poker or social casino gaming does not imply future success at cash poker games or real money gambling.","Poker Texas Holdem Live Pro","GameDesire",N/A,"https://play-lh.googleusercontent.com/eYf4e1BsH7q1myo1xc8Q417q_5hnJMkfk9HQjalG-8TdH4kIVF5fLHkMrzYhzWZUzg",4.2696333,"4.3",N/A,true
