url,appId,summary,title,developer,developerId,icon,score,scoreText,priceText,free
"https://play.google.com/store/apps/details?id=tech.hypergames.lifesim2","tech.hypergames.lifesim2","🎤Do you dream of becoming popular? Then LifeSim is the game for you! Just one tap separates you from the life of a real Hollywood celebrity!!🎬<br><br>You will star in the most famous TV series, become the highest grossing actor on the planet &amp; record a platinum album! You will become the face of a famous brand, an ambassador to the UN, stage dive into a crowd of your loyal fans &amp; even get to direct a musical. All this you can do in our life simulation game!<br><br>Commute to work in your private helicopter, live in a castle &amp; become the owner of your very own private island. Build your career: from getting hired as an extra to becoming a superstar. Find a life partner that you will be comfortable with &amp; overcome all of life’s obstacles together.<br><br>👨CHOOSE YOUR CHARACTER👩<br><br>Choose the character most similar to you from a huge variety. Choose wisely because in the game you will live a whole second life for him.<br><br>🎬START YOUR CAREER FROM THE VERY BOTTOM &amp; BECOME A FAMOUS HOLLYWOOD CELEBRITY🎤<br><br>You will start a game with a temporary job like a janitor or barman in this simulator. The most important thing is to grab fortune by the tail at the right time &amp; take a first step on the road to success. Whether you will be able to complete it to the end depends only on you.<br><br>🚗CHOOSE CAR &amp; HOUSE YOUR LIKE🏡<br><br>In the game, you can make choices. What do you prefer to drive - a sports car or a limousine? Or maybe you could buy something eco-friendly like an electric supercar. For those who like to travel fast, we have a personal helicopter. Want to get a bird&#39;s eye view of the city? Check in to the penthouse on the top floor of a skyscraper. Afraid of heights? Pick a mansion &amp; never go higher than the second floor. Want to get away from the hustle &amp; bustle of the city &amp; the paparazzi&#39;s attention? Move to a private island where you will be the sole full owner. All of this is possible when you are a Hollywood celebrity.<br><br>❤️WATCH YOUR HEALTH &amp; MOOD💙<br><br>As in real life, in our game you must always be in good shape. Only a healthy &amp; happy character can fulfill all his dreams. Lead a healthy lifestyle, do fitness &amp; meditation, attend concerts &amp; museums with your friends - do everything to keep your character healthy &amp; happy. Just like in other life simulation games.<br><br>👔Fulfill your most cherished dreams in LifeSim. In LifeSim, you can be anyone!<br>Remember, that your decisions affect your fate &amp; only you can choose the right path to success!👠<br><br>💸Now you know what to do! Download LifeSim career, job &amp; life simulator game right now for free!💸<br><br><br>If during the game you have any problems or want to make any suggestions, please contact: support@hypergames.tech.","LifeSim 2: Career, Business & ","Hypergames, Inc.",N/A,"https://play-lh.googleusercontent.com/9G3i8oVT5M24soPKh8T20qaO47GM8birX_dDcxychFbZet3e7uSZGIj9xmMn99fNJC9M",3.2417583,"3.2",N/A,true
"https://play.google.com/store/apps/details?id=com.candywriter.doglife","com.candywriter.doglife","What would it be like to live life as a dog?<br><br>Say hello to DogLife, the <b>NEWEST</b> addicting text-based life simulation game from the creators of BitLife!<br><br>Will you be a ruff-and-tough stray dog on the streets, an attention-hungry house dog, or man’s best friend who’s a little bit pampered in this interactive storytelling life sim game? Your story is <i>YOURS</i> to unfold as you interact with <b>HUNDREDS</b> of scenarios on your journey to become the friendliest (or <b>TOUGHEST</b>) dog on the block. This addictive game will have you coming back for more–no two DogLife lives are the same!<br><br>There are <b>SO</b> many breeds to choose from! Play as a golden retriever, bulldog, German shepherd, rottweiler, pitbull, Shiba Inu, and <b><i>MUCH MORE</i></b>!<br><br>⬆️ Climb to the <b>TOP</b> of the animal hierarchy. Show everyone you’re the baddest dog around, and <b>SCHOOL</b> everyone on why dogs are better than cats!<br><br>🏠 Where will you live? Choose one of <b>FOUR</b> unique habitats as the starting point for your dog’s story: a household, a shelter, a pet store, or a stray dog on the streets.<br><br>🎗️ <b>COLLECT</b> achievements and ribbons to commemorate the stories you’ve lived!<br><br>🐶 Introducing our <b><i>ALL-NEW</i></b> kennel feature! Send one puppy or dozens of puppies to your friends!<br><br>🐈 <b>INTERACT</b> with other animals! Will you continue the feud between dogs and cats, or will you be everyone’s faithful friend?<br><br>🐾 Got a special dog in your life? Use our <b>custom character</b> feature to recreate your precious pet and live out their virtual life!<br><br>🐱 What’s that dirty kitten smell?! Become the scent collector as you add as many smells to your scent database as possible!<br><br>😈 Don’t be idle! Work your way through <b>DOZENS</b> of scenarios that’ll put you at the top of the food chain! Show that annoying street cat that you don’t play games.<br><br>The possibilities are <b><i>ENDLESS</i></b>! Your choices determine your fate. Start your DogLife journey ASAP and see how your sims’ stories unfold!","BitLife Dogs – DogLife","Candywriter, LLC",N/A,"https://play-lh.googleusercontent.com/7JYTz6ShspYb-D_LheeRBro4-mq-occV7yVvz-1Qx7XCng-xSdJehPqgsvAy9zX6ZeZ8",4.4449854,"4.4",N/A,true
"https://play.google.com/store/apps/details?id=com.red.business","com.red.business","“My Success Story” is the most realistic life simulator game where you can get everything you miss in your real life. Simulation let you rise from rags to riches and get filthy rich. Start a family and run your own business in!<br><br>Is a dollar in your pocket and a room in the dorm all you have for now? Make choices to have a better life with work and family that you want! Try to become rich and successful business tycoon. Can you earn money to possess wealth and run your own business company? Check it out!<br><br>Features:<br>- Graduate from a university to take a high post and reach real success fast;<br>- Choose your life skills, find a job and build a brilliant career;<br>- Run your business company and become a tycoon;<br>- Get married and make a family to enhance your position in the society;<br>- Win in casino and bet on the stock market to double your idle income;<br>- Buy as many luxurious cars as you want, villas, planes, and even an island!<br><br>TURN FROM A POOR TO RICH TYCOON<br>Sounds crazy, isn’t it? Everything is possible in this offline simulation game. Start your sim’s life from zero, and become a billionaire hero from a bum! Make money and rise from rags to riches. Don’t be a quitter and get idle income in cash, gold. Multiply your wealth with every new level!<br><br>SEE HOW FAR YOU CAN MOVE<br>How rich can you become? It’s your success story: get the first job, rent an apartment and climb the career ladder to be a boss. Earn money to start a realistic business. Do you have what it takes to become a sim billionaire? Think like a boss, evolve your life skills and become the president of your company!<br><br>START BUSINESS ADVENTURE<br>Find your way to make money as a capitalist or tycoon or an office worker. Live as a poor idler or become the youngest billionaire in the world. Choose the real life sim that suits you the best. Learn the steps to success and find out the business secrets in the family and work games. Rise from zero and become a rich tycoon hero in my life simulator games!<br><br>Play this realistic life simulation game offline and get everything you want with millionaire fortune. Make money, become a billionaire and rule the real business world!","My Success Story Business Idle","FLY FLO GAMES YAZILIM TICARET ANONIM SIRKETI",N/A,"https://play-lh.googleusercontent.com/Cjhxl09WYgJ-_LvKecTnFTL15uAcGfhLxI3bYmuNBaMM7Cm2X-Il-ZRybElYIsfv_A",3.8896296,"3.9",N/A,true
"https://play.google.com/store/apps/details?id=com.ldw.vf3","com.ldw.vf3","The sequel to the smash hit mobile game “Virtual Families 2” is here!<br><br>ADOPT YOUR FAMILY TODAY!<br><br>Adopt a little person from the thousands living inside your mobile device!  In this life simulation game, help them choose a husband or wife and start their virtual family!  Make babies and pass the house on to the kids!  Help nurture and guide generations, managing your own beautiful family story.<br><br> DESIGN YOUR DREAM HOME<br><br>Expand and renovate your virtual house.  Your adoptee’s new home has a lot of potential, but they need your help to fix it up!  Imagine your dream home and make it a reality.  Add bedrooms, a garden, a home theater, or even a game room!  Collect decorations to customize and design each room.<br><br>MAKE A HAPPY, PROSPEROUS LIFE <br><br> Train your little people from babies to adulthood to take care of their home and make the best choices in life.  Encourage them to work on their career and earn money for decorations, necessities, and luxuries.  Upgrade your virtual family to be the best versions of themselves. Your little people will send you messages, thanking, pleading, and praising you for caring for them.  Don’t forget to check in on them, because they miss you and become very sad!<br><br>LIFE SIMULATION RUNS IN REAL TIME!<br><br> Your little family continues to live, eat, grow, and work when the app is switched off.  Along the way, there will be many different random events to respond to, all of them adding surprise to this simulation game and unexpected elements to routine, daily virtual life.  Find highly varied, unpredictable game play. No two games run the same; the story unfolds differently for everyone who plays it.  This simulation game is designed to have a life of its own!","Virtual Families 3","Last Day of Work, LLC",N/A,"https://play-lh.googleusercontent.com/ov2XPMKz-vR3icaUQIPKSL6uqFpqJoL4OjF0-hq5u6MynaMPtfYcI68QF2TN3dWYW5Y",4.552087,"4.6",N/A,true
"https://play.google.com/store/apps/details?id=com.manababa.BeggarLife3","com.manababa.BeggarLife3","Beggar Life 3 is the 3rd addition to the Life series that combines idle and clicker games.<br>If you are looking for a fun, addicting game, try playing Beggar Life 3~!<br>Below are the features of the game~<br><br>[Make Money]: Tap the screen or build shops like a tycoon game and sell products to customers.<br>[Beggar Power]: Enhance your tapping ability and earn money faster.<br>[Shop]: You can build and run shops to sell various foods.<br>[Part-timer]: Hire part-timers to work at your shops.<br>[Customer]: If you upgrade your customers, the auto-visit rate increases so you can idly enjoy the game.<br>[Skill]: You can make more customers visit your place more often or make more money using skills.<br>[Construct]: Develop the Empty Lot and change the desolate wasteland into a brand new city.<br><br>We&#39;ll continue to do our best to deliver the best gaming experience.<br>Thank you<br><br>If you have any other questions, send us a mail with the address below~!<br>manababagames@naver.com","Beggar life 3 - store tycoon","manababa",N/A,"https://play-lh.googleusercontent.com/QEjgnIy_tSxBHxfXvnzylDXyfxUj43UwgGNvSaBxnnKmmgVslmjNZKIjhHmNUYwYhRLH",4.612903,"4.6",N/A,true
"https://play.google.com/store/apps/details?id=air.bg.lan.Monopoli","air.bg.lan.Monopoli","3D version of the classic dice board game - online live with friends","Rento - Dice Board Game Online","LAN GAMES LTD","7315871763609983366","https://play-lh.googleusercontent.com/9ceBAFWt9z-KG1OAcAMQjz4xIMSN59B7kiiwztCiWlb1rSSqC68UwyO8s3PSLhO5NHE",4.137528,"4.1",N/A,true
"https://play.google.com/store/apps/details?id=net.boardgamesonline.Rento2D","net.boardgamesonline.Rento2D","Rento2D is Lite version of the original game - optimized for older smartphones and maximum battery life.<br><br>In this lite version, there is no heavy animations, no effects and the gameboard is 2D instead of 3D. <br><br>The game can be played by minimum of 1 and maximum of 8 players<br><br>In order to win, you have to upgrade your castles, exchange lands, participate in auctions, spin the Fortune wheel, engage in RussianRouletts and ultimately - bankrupt your friends. <br><br>As this game is online multi-player, this means that you can bring your whole family to play together - even if you are on a different continents.<br><br>The game support 5 modes of gameplay<br>-Multi-Player live<br>-Alone - vs our artificial intelligence<br>-WIFI play - 4 players max<br>-PassToPlay - on same smartdevice<br>-TEAMS - the players in all previous modes separated by 2, 3 or 4 teams","Rento2D Lite: Online dice game","LAN GAMES LTD",N/A,"https://play-lh.googleusercontent.com/y1lsqiiCzuu2P9M5c5XMe_y4anZJS2ZpX3VyNonzfBTJYz_EdTmn8EWTo_Jr3l6EAYs",4.67,"4.7",N/A,true
"https://play.google.com/store/apps/details?id=com.moonfrog.ludo.club","com.moonfrog.ludo.club","Play LUDO CLUB - the best board game to play with friends!  You can play with 2 players or more (up to 4 players).Enter the world of this multiplayer color game - ludo, and be a ludo star (لودو ستار)!<br><br>This is the free online multiplayer version of the epic hit dice game Ludo (which also has variations such as parchisi, parcheesi around the world)! It is also misspelled as lado, lodo, iodo and lido. <br>Join an exclusive club of star players in this multi color game of ludo - roll the dice with buddies, master the skills of this ludo game and become the KING OF LUDO!<br><br>As far as lively board games full of color go, Ludo Club is unmatched! Learn how to move your red, yellow, green or blue pieces with strategy and luck on the best looking games board of this online ludo game. Compete against the best ludo masters from around the world and reach the top of the leader board! This is a fast, dice roll based board game that involves both luck and skill (just like parchisi, parcheesi or if your like tictactoe)! Master the various tips and tricks of this exciting dice game and show your best talent to everyone! Be the ludo king of the world and become a ludo star(لودو ستار)!<br><br>Ludo Club has several exciting features!<br>👬 You can play this game like as tabletop game tof dice with buddies and family by sending Facebook and WhatsApp invites!<br>📶 You don’t need to sacrifice your data to become a ludo star(لودو ستار), Ludo Club uses very little data and runs very smoothly on 2G, 3G, 4G! So don’t worry and enjoy this multi color game with gameplay very similar to parcheesi!<br>💻 This online ludo app also includes support for offline play and vs Computer! So you’ll never be alone even if you can’t play this ludo game with friends!<br>💬 You can roll the dice with buddies and also chat with them simultaneously on the games board of this ludo game! If you have already played parcheesi with friends, playing this multi color game of Ludo will be cakewalk for you!<br>🤩 This dice game also offers two game modes for you to master - Classic mode for those who prefer the steady dice roll of the original relaxed lodo and Rush mode for those who like it fast and furious!<br>💰 This ludo game is very F2P friendly, you can win free coins using our Daily Bonus and Lucky Dice roll features so that you don’t run out of coins in your journey to become a ludo star(لودو ستار)!<br><br>Looking for hours of non-stop enjoyment on your phone? Install Ludo Club and play everyone&#39;s favourite childhood board game of lodo from the developers of India&#39;s favourite games Teen Patti Gold and Jalebi. This ludo game is available in loud, striking colors and beautiful board and dice designs for your phone&#39;s HD display. Play this game of lodo - an exciting variation of parchisi (or parcheesi), domino. Make buddies (you can play with 2 players or more (up to 4 players)), become a ludo star(لودو ستار), and dive into the exciting world of this multi color game of Ludo Club!<br><br>If you like tic-tac-toe or dominos, then you probably like the tabletop board game Ludo Club. What are you waiting for? Download this amazing dice app and board game today, host a Ludo party, and roll the dice with your friends!","Ludo Club - Dice & Board Game","Moonfrog",N/A,"https://play-lh.googleusercontent.com/9jnWEhWMGhsPnDN6DyzfNkv6DwxyzebUmKlUNtUVYTw3-ztghgR1Ph2OnVM3Xv5yHp2r",4.2613726,"4.3",N/A,true
"https://play.google.com/store/apps/details?id=com.miniclip.ludo","com.miniclip.ludo","Ludo Party is a tabletop dice board game. Score all your pucks to beat the opponents and win exciting rewards. Ludo is the game of kings. Play with your friends, show off your ludo talent, and become a superstar. <br><br>Ludo Party offers a multiplayer player vs player dice game with fascinating boards, dice, and pucks. Show them who&#39;s the king! Are you up for a challenge? Walla, a new ludo game has arrived. <br><br>Ludo is a variation of the Indian game Pachisi, but simpler! In some parts of the world, it is known as Parchis, Parchisi, Sorry! Or Trouble! Play on glorious arenas and clubs around the world and show off your style. Do you have what it takes to become the star ludo player?<br><br><b> Features: </b><br>► Play Popular Ludo game with friends &amp; family, NOW featuring Voice &amp; Video chat<br>► Multiplayer 2 player and 4 Player matches with real players from around the world.<br>► 4 player challenges. Play with your friends and family. Become the Ludo king.<br>► Practice in offline mode. Earn a variety of dice and pucks.<br>► Multiple arenas around the world and win free victory chests on winning matches.<br>► Play multiplayer ludo matches and win exciting rewards through weekly leaderboards and championships.<br>►  Different game modes: Master, classic, quick, and rush modes.<br>► Brand new season passes each month with exciting rewards.<br>► Coming soon: Join ludo clubs, win tournaments and become a ludo star<br>► Create and join lobby rooms. Invite your friends and friends of friends to play against each other.<br><br><b> How to play: </b><br>► Roll the dice<br>► Move the puck <br>► Be the first to score the puck<br><br>As easy as it gets! Gather friends to have top fun and play this great classic and super-popular dice board game from when you were a kid. Show off your talent as you improve your skill more and more and become a ludo star player!<br><br>Download NOW!<br><br>https://www.facebook.com/Ludopartydiceboardgame/","Ludo Party : Dice Board Game","Miniclip.com",N/A,"https://play-lh.googleusercontent.com/agO2GK3yM4kqmPLFDRlVZ4IVj1naCLUyGPEYxH5ky3nrP2WGbQj8xD_LLSP0C5mABiI",4.0955415,"4.1",N/A,true
"https://play.google.com/store/apps/details?id=com.superplaystudios.dicedreams","com.superplaystudios.dicedreams","<b>Welcome to Dice Dreams! <br>Join millions of players around the world! Roll the Dice on the magical board, Steal Coins, Attack your friends, build your Epic Kingdom and Embark on an adventurous journey! </b><br><br>🍿🍿The Legend Behind The Dice🍿🍿<br>Bob, the first of his name, returned to his kingdom after a journey visiting the Piggy King, only to find that his beloved home had been attacked!<br>Brave Bob decided to roll the dice and clash his enemies head on. He gathered his fellow peons, and together they went on an adventure to rebuild his kingdom, get revenge, and once again become the Kings of the hyper magical dice board game.<br><br>Will you help Bob and his friends on their quest to regain their throne as the Dice Dreams Kings? Will you travel through Peon Islands and other dreamy boards to bring them back to glory? <br><br>📋 Features: <br>🎯 Play for FREE with your friends and enjoy a variety of kingdoms. 🎯 <br>🎲 Join the action with players from around the world and play with your social network. <br>🎲 Steal from other boards and show them who&#39;s the Dice Dream King 😉 <br>🎲 Invite your Facebook friends to join the epic fun and become the master of the dice boards! <br>🎲 Protect your treasure and build the most magical kingdom! <br>🎲 Roll and play to collect cards by completing challenges and move up in levels!<br><br>🎯Roll &amp; Win🎯<br>🎲Go On and Roll the dice on the board, Win Golden Coins &amp; collect gems to build your kingdom, become the Dice King and master the dice board game! <br><br>Has your kingdom been attacked by a friend? It&#39;s time for revenge! Steal coins from them and upgrade your kingdom with the perfect bonus. Expand your kingdom by building more and making the Peons happy! Don&#39;t wait any longer, start building your kingdom and win amazing prizes!<br><br>🎲 Raid your enemies or friends. Just aim your slingshot, fire, and loot away! 🎯<br> 🎲 Earn gold by stealing from other kingdoms and making their treasure YOURS! <br>🎲 Get revenge on those who attacked your kingdom. <br>🎲 Become the master of the dice and help the Peons restore their kingdom! <br>You never know what treasures you can find in your friend’s kingdom. Attack and be surprised!<br><br>Get ready to go on an epic adventure with Dice Dreams!<br>Build your empire, attack your friends&#39; boards, and earn awesome prizes and coins! Will you be the master of the dice board game? With a variety of exciting challenges, there&#39;s always something new and thrilling to go for in Dice Dreams. So start building and become the ultimate Dice Dreams champion!<br><br>🎯Dice Dreams is free on all devices with in-app purchases.<br><br>🎯Follow Dice Dreams on Facebook for exclusive offers and bonuses!<br>https://www.facebook.com/DiceDreams/<br>🎯Are you having problems?<br>Please contact via email us at support@superplay.co","Dice Dreams™️","SuperPlay.",N/A,"https://play-lh.googleusercontent.com/IIGsWtdZWnn2-_ykp04KeAWsxHNJzLDaU-dxGc92cW9eUoNL5Yev5aR_yg-s4yBcM1dg",4.70398,"4.7",N/A,true
