url,appId,summary,title,developer,developerId,icon,score,scoreText,priceText,free
"https://play.google.com/store/apps/details?id=air.air.BusinessmanSimulator3","air.air.BusinessmanSimulator3","This is not an ordinary business simulator game that you have played before. There are many ways to earn money here. You can play just like other clicker games or follow a non-standard path. You can become the richest capitalist with a big capital (according to the Vorbis magazine, of course), ahead of other entrepreneurs and their businesses. You will be able to manage businesses: car factory, smartphone factory, oil production, building construction and other companies. They all produce and consume resources. You can sell goods and manage your profit, hire professional managers which can increase your money. Also, there is a huge number of interesting missions. The game will bring pleasure to those who likes to think, solve puzzles. Start your adventure from burger company owner to the richest capitalist right now!<br><br>These are the main differences from ordinary business games and tycoons:<br>- There are many ways to earn money.<br>- Traditionally, three exciting mini-games.<br>- 12 businesses with tons of unical upgrades.<br>- Unboring incremental progress.<br>- You can take a loan in a bank to upgrade businesses right now.<br>- In addition to the standard there are assignments for desirability (it will not be easy to solve all of them).<br>- A bunch of fictional companies, each offers its prices.<br>- In-game magazine &quot;Vorbis&quot; (compares you with the best entrepreneurs of the game).<br>- A huge number of interesting missions.<br>- A combination of clicker, idle and mini-games in one game.<br>- You can play offline.<br>And all this in one clicker!<br><br>The game was created with Flash Develop, Adobe Air + Starling.","Businessman Simulator 3 Idle","jamboska",N/A,"https://play-lh.googleusercontent.com/AOHxBZaAS9Uvhv7eXTPaTAtYoGUWmi9M0NJnf7ME5EF8CNd1-tdUp5n8HmX41gGrNA",4.33,"4.3",N/A,true
"https://play.google.com/store/apps/details?id=com.WayneMobile.From.Homeless.to.Successful","com.WayneMobile.From.Homeless.to.Successful","Turn from a homeless without house and money into a successful and rich businessman in the best life simulator game of the year. Start from the bottom, working to save all the money which you need to create an idle business and if you work hard and make the right decisions, you can become an incredible rich businessman with an amazing career. This life game will allow you to become the new Jeff Bezos or even richer than him!<br><br>You will start without money in your pocket and living in some public bedroom like a homeless, then you will have to make some decisions in this life simulator game to make enough money to build your first business. Work hard everyday in your business and the success will be part of your life, you will become a rich businessman and you will have enough money to increase your profits investing in other business like the stock market or creating new business like a pawn shop.<br><br>After becoming a successful businessman, you will have to take care of your personal relationships and health like real life. Keep in mind that all the super billionaires have a successful life with a lot of money, rich friends and crazy parties where everybody spend a lot of money. This life simulator or life game will offer you all these experiences from your mobile. It’s truly amazing to pass from homeless to a successful businessman!<br><br>You will have some goals in “From Homeless to Successful Businessman” and some incredible features:<br><br>CREATE YOUR OWN CHARACTER<br><br>You know that you will start from the bottom, being a homeless and without money to invest but in this life simulator game, you can create the person who you ever wanted to be. If you ever wanted to have blue eyes and long brown hair, “From Homeless to Successful Businessman” is your game for sure.<br><br>GET A BRILLIANT CAREER<br><br>Although you start like a homeless, you can change your life if you save money and start to study. Business administration and learn how to become rich at university.<br><br>You will have to start to work for some billionaire at the beginning but if you work hard, you will get success and a brilliant career as a businessman. Your only objective is to be like Jeff Bezos so if you want to be billionaire, you have to save money and create idle business in this life simulator game!<br>HAVE A WONDERFUL FAMILY<br><br>Relationships are important for human beings so you need to take care of your social needs. Make social decisions for your character like going to the casino, to a crazy party or to meet any special girl for you.<br><br>Who knows… maybe you can have a wonderful family with all the money of your businesses and stock exchange.<br><br>Your relationships and friends will affect your businesses and your career so be careful with this or you will end in the street again like a homeless!<br><br>INVEST THE MONEY WHICH YOU SAVE<br><br>As a businessman, you will have more money which you spend every month so you will need to invest your money in other businesses like the casino or the stock exchange. You will be able to duplicate your money and your social status will be even better than jeff bezos, the richest billionaire in the world!<br><br>BUY AMAZING THINGS<br><br>The advantage of becoming rich and successful is that your social status and your bank account are enormous! In “From Homeless to Successful Businessman” you can buy incredible super cars like lamborghini, ferrari, bugatti, big mansions with a lot of girls inside or even an entire football team!<br><br>Remember that if you work hard, you will be a successful business man in life and therefore, the money and success will be part of your life in this game.<br><br>You can have everything you want in your real life but playing an incredible life game or life simulator. Earn billions of dollars and get a special social status to write your own successful history.<br><br>From Homeless to Successful Businessman is the best life simulator of the year so if you didn’t download it, don’t wait more and start a success life in the best business and life simulator game!","My Success Story Business Game","Cookie Games Mobile",N/A,"https://play-lh.googleusercontent.com/iwzyXwqyt5DK0jzbZYecV-jyvggwGjy7ZC1DMBNmn0rp-3UBbzm2q2ZPnkUCGq22Attk",4.55,"4.6",N/A,true
"https://play.google.com/store/apps/details?id=com.virtonomics.twa","com.virtonomics.twa","If you are looking for a casual economic game with simple and obvious gameplay, Virtonomics is NOT for you. Please, find something else.<br><br>Virtonomics is one of the MOST DIFFICULT AND HARDCORE GAMES in the world with complex and varied gameplay, with many hidden features. To learn how to play Virtonomics and successfully compete with other players, you will have to study and read the extensive help, you will have to experiment a lot and make mistakes. Everything is like in real business. Don&#39;t count on a simple game.<br><br>Virtonomics’ business simulation offers you 3 versions of the game to choose from, depending on your preferences:<br><br>1. The business simulation game “Virtonomics: Tycoon&quot; <br>2. The economics game &quot;Business &amp; Mafia&quot; <br>3. The startup simulator &quot;Virtonomics: Entrepreneur&quot;<br><br>THE BUSINESS SIMULATION GAME &quot;TYCOON&quot; (Free-to-play)<br><br>Fans of smart and leisurely turn-based strategy games like “Civilization” or “Capitalism” will find “Virtonomics: Tycoon” to provide an extremely creative, research-based and analytical gameplay in the form of a serious business simulation with a deeply developed virtual economy and almost unlimited player capabilities. You will definitely appreciate Virtonomics, and you will be able to enjoy it for many months and years, just as thousands of our players have done. <br><br>The goal of this exciting game is to build a globally efficient business in a competitive environment. You get start-up capital and can develop your virtual company according to your own desires. You can build a distribution network, an agricultural tycoon or an industrial empire. You can focus on high technology or research. You can conduct urban planning, engage in political struggles and even public administration. The richest choices are at your fingertips! Build the largest business empire that the world has ever seen!<br><br>THE ECONOMICS GAME &quot;BUSINESS &amp; MAFIA&quot; (Free-to-play)<br><br>A truly unique economics game! Develop your company, create new industries, change the global economy, defeat competitors and the mafia, even become the president of your country.<br>Your secret agents and corporate security services have at their disposal the broadest arsenal of legal and illegal methods of competition.<br><br>- Over 200 different industries for your virtual business<br>- Dozens of countries where you can create your own political party and become a governor or the president.<br>- Your own corporate secret service.<br>- The possibility of colluding with other players in a corporation or mafia clan.<br>- The richest PvP arsenal which you can use to attack competitors and protect your interests:<br>-- industrial espionage and private detectives,<br>-- computer viruses and technological sabotage,<br>-- train heists and bribing the sheriff,<br>-- contracts with the mafia,<br>-- and many other legal and illegal methods to secure your place at the top of the food chain. <br><br>Show this world who you are, what you are capable of and what you deserve.<br>Show everyone your potential and your ambitions. You are worthy of wealth, fame, power, and your place at the top of a global economic hierarchy. Create the most powerful financial empire, capable of managing the global economy. Don’t play by someone else’s imposed rules, create your own laws and rules of life.<br><br>THE STARTUP SIMULATOR &quot;ENTREPRENEUR&quot; (Subscription)<br><br>A business simulation for aspiring entrepreneurs and business owners. Experiment and train to manage a real company in a simulation without risking your actual business or capital. Learn by playing!<br>It’s no secret that 80% of startups go bankrupt in the early years precisely because of the lack of experience of the founders. Therefore, we have created for you a unique, one-of-a-kind business simulation that allows you to create a virtual prototype of your future business in a very realistic competitive environment.","Virtonomics business game","Virtonomics Team",N/A,"https://play-lh.googleusercontent.com/heS_eC0K_fcXQDwNmjMtbqnnptRc11zFY8ma2YV77rXP7q2lBQ_zISzz8wrygBfwLJ5X",3.7619047,"3.8",N/A,true
"https://play.google.com/store/apps/details?id=com.michael.tycoon_company_manager","com.michael.tycoon_company_manager","Manage your company and build a monopoly! <br><br>Do you have what it takes to be a wealth builder and a tycoon business manager?<br>Put your business strategy-making skills to the test in an intense, challenging real-time strategy game available online! <br><br>The trade Tycoon Business Game is a realistic company tycoon game where you raise and manage your own company. Play this fun, relaxing game for free, manage your own company, and become the world&#39;s strongest empire! <br><br>Are you ready to be the best business manager and wealth builder in the business simulation world? This business simulation entrepreneur game is designed to give you realistic tycoon game challenges that you must complete to scale your business and grow.<br><br>Try Tycoon Business Game – Empire &amp; Business Simulator now!<br>FEATURES of Tycoon Business Game – Empire &amp; Business Simulator:<br>- Play and enjoy a realistic world map with other players’ companies, famous world sites, banks, mines, stock exchanges, and many more!<br>- Enjoy premium resources: Buy gold coins, and use them to purchase a variety of upgrades like money, special units, hurry productions, etc<br>- Trade daily in commodities like oil barrels. Buy concessions and unlock new financial markets<br>- Buy business and transportation lines and trade resources<br>- Buy investments like a soccer team and utilize them on the world map<br>- Research new products, improve your company’s capabilities and growth<br>- Use real-time strategy to acquire resources and become a trade tycoon<br>- Participate in business challenges with real-world scenarios such as taking a loan from the bank, the viability of manufacturing products, etc.<br>- Recruit an army that will defend your assets and attack your rivals!<br>- Invest in startup companies in various fields from high-tech to Cyber and health<br>- Trade stocks and perform daily trades at the NYSE stock market in New York<br>- Build Mega-Projects like constructing nuclear plants, an underground hotel, etc,  and sell them to countries worldwide<br>- Participate in your country&#39;s National Congress and vote on strategic moves. Members of Congress can also start a war on another country and then actively participate by attacking the opponent and donating money to their country <br>- New in Tycoon Business Game: No more waiting! No more action bar. As long as you have the money, you can continue evolving!<br><br>PLAY WITH FRIENDS<br>In the Tycoon Business management game, all players compete against each other for a worldwide ranking! <br>* Communicate, ally chat, protect and attack other players!<br>* G20: the group of 20 top industrial countries is now placed on the world map<br><br>POLISH YOUR BUSINESS MANAGEMENT SKILLS<br>Come up with a business strategy to trade resources like mine, gold, and gems. Buy businesses, transportation, natural resources, manage concessions, make investments, research new technology, trade in the stock market, and many more in one of the best real-time strategy business tycoon games.<br>REALTIME STRATEGY GAME<br>Visit world sites and perform various actions like mining for natural resources, arranging tourist guides, experimenting with new technologies, making more money and profit in business, and outperforming rival tycoons. Compete against other players and choose whether to join forces in an alliance or become rivals. <br><br>COME UP WITH THE BEST BUSINESS STRATEGY<br>As financial companies become stronger, richer, and more powerful, you get to train army units to defend your assets and money at later stages of the game. <br><br>BECOME A TRADING TYCOON<br>Take your business skills to the max in one of the best business simulation tycoon games. The company and business manager are competing to become the richest and strongest tycoon and wealth builder globally.<br><br>Start as a small entrepreneur and build your way to be the world&#39;s strongest, wealthiest business empire owner and wealth builder!<br>Conquer the market and become a business empire! Become the landlord manager of your company and enjoy playing this addictive time-killing game!","Tycoon - Business Empires MMO","Super Blast Games",N/A,"https://play-lh.googleusercontent.com/YrL3RrEx0tcVD0LGtcOnqpzma1tTJDXhMuV9p0ZX12tSCIE90rmelKipd98gUxln6Q",4.4565215,"4.5",N/A,true
"https://play.google.com/store/apps/details?id=com.auxbrain.egginc","com.auxbrain.egginc","In the near future, the secrets of the universe will be unlocked in the chicken egg. You have decided to get in on the gold rush and sell as many eggs as you can. <br><br>Hatch chickens, build hen houses, hire drivers, commission research, launch space expeditions(!) to build the most advanced egg farm in the world.<br><br>An incremental (clicker) game at its core, Egg, Inc. uses many elements from simulation games that give it a unique feel and play style. Instead of menus, you are presented with crisp and colorful 3D graphics and a delightful simulation of a swarm of chickens. In addition to choosing your investments wisely you must also balance your resources to ensure a smooth running and efficient egg farm.<br><br>There is something for everyone here:<br>Casual players love Egg Inc&#39;s laid back feel and beautiful appearance. Take your time to build a wonderful egg farm and explore all the content.<br><br>More experienced incremental (clicker) players will love the emergent gameplay and depth afforded by the different play styles needed throughout the game. To reach the ultimate goal of having a ginormous egg farm with an astronomical value, you will need to balance strategies throughout many prestiges to make best use of your time.<br><br>Features<br>- Simple, Casual gameplay with opportunities to challenge yourself<br>- Chicken swarm!<br>- Dozens of research items<br>- Hundreds of challenges<br>- Many different hen houses and shipping vehicles<br>- A &quot;Nested&quot; (pun intended) Prestige system has the game always feeling new<br>- Late game depth with cooperative play, deck building mechanics, and even space exploration!<br>- Wonderful 3d graphics with pixel perfect UI and shadows<br>- Google Play Games Achievements &amp; Leaderboards!","Egg, Inc.","Auxbrain Inc",N/A,"https://play-lh.googleusercontent.com/dJ-uU6W8_HdX3ZDf5CUwOlJmWn6fbWwqTtzeq8RKA_CLPGMyydDQMrcw135cM44TVyU",4.6719556,"4.7",N/A,true
"https://play.google.com/store/apps/details?id=com.UmarKhaleeq.LifeSimulator","com.UmarKhaleeq.LifeSimulator","<b>The Life Simulator Game 2023 where you can get everything you miss in a new life </b><br><br>&gt; Work the job you like most.<br>&gt; <b>Earn money</b> from various sources.<br>&gt; Get <b>Education</b> to improve your skill set.<br>&gt; <b>Shop</b> anything with your money. <b>Entertainment</b>, fun and travel around the world.<br>&gt; Buy and sell businesses. Become a <b>business tycoon</b><br>&gt; Invest in shares in <b>Stock Market</b><br><br>&gt; Manage <b>Social Media</b> and earn ads money<br>&gt; Earn interest from <b>bank savings account</b><br>&gt; Start your own <b>Taxi Cab Business</b> and operate taxi business in multiple cities around the world.<br>&gt; <b>Develop your app</b> from scratch, add features of your choice<br>&gt; Live your Life the way you want<br><br>&gt; Make Money, get filthy rich and run your own business in Life Simulator Game - the most realistic <b>FREE life simulation business game</b><br>&gt; Start your business from scratch. Investment money and time to generate big amounts of money<br>&gt; Buy or Sell business / properties.<br>&gt; Invest in Stock Market.<br>&gt; Live Luxurious Life. Buy Cars, Boats, Bikes and Planes.<br>&gt; Eat healthy and join a gym. Wear Luxurious Clothes.<br>&gt; Make your own decisions in your second life.<br><br>Prove that you were born for a better new life! Become a rich and successful business tycoon, earn money to possess wealth and run your own business in this Life Simulator Financial Game.<br><br>Ever wanted to build wealth and earn money like rich people do, having a constant income and cash flow so you can enjoy the desired financial freedom?<br><br><b>Learn the monopoly of the real life finance world !</b><br><br>Life Simulator the game of life gives you the cool experience of a good business game at the same time it teaches you the real life money management skill which you can implement in your life. Players playing this game will be interested in passive income and cashflow quadrant book.<br><br><b>Practical Implementation Of The Greatest Financial Books !</b><br><br>The Developer of this money race game is a huge fan of Robert Kiyosaki sir. Instlife Instcoffee life sim sorority game will teach you concepts of RIch Dad Poor Dad, Think And Grow Rich (Napoleon Hill) , Cashflow quadrant game and other financial books.<br><br><b>Become An Entrepreneur !</b><br><br>Instalife: This game teaches you the importance of being an entrepreneur and the solutions to the problems faced by an entrepreneur all life. This game answers the most important question: <b>How To Become An Entrepreneur?</b><br><br><b>Develop mobile app and run it as a business</b><br><br>Develop your app with features of your choice. Manage employee, train CEO for effective headhunting, multiple hosting plans and marketing strategies to gain users for the app.<br><br>Everything is possible in this simulation money race game: start your life From Zero to Hero cityman, make money and rise from rags to riches. <br><br>Turn from a poor homeless to rich tycoon and billionaire! Sounds crazy, isn’t it?<br><br>Don’t stay idle - get idle income in cash and gold and multiply your wealth to win the money race in finance world!<br><br>City Life Simulator is the game to really test your financial skills. From zero to hero become a rich business tycoon guy.<br><br><b>How rich can you become in a Financial Business Game?</b> <br><br>It’s your success story: get the first job, rent an apartment , get education to climb the career ladder. Earn money to start realistic business. Do you have what it takes to become a sims game billionaire?<br><br><b>Would you like to live a luxurious life? </b><br><br>You can buy as many cars, boats, bikes and planes as you want with all your millionaire bank. And you will still have enough to buy several villas, king&#39;s castle, properties around the world or even an island!<br><br>If you like tycoon games, idle money cash games and management games, you will enjoy this life sim game. In this game you can easily run your own business with different shops,parking lots,clothing stores and restaurants. Make important management decisions to build your business empire and grow your LIFE From Zero to Hero!!!","Business Life Simulator Game","Umar Khaleeq",N/A,"https://play-lh.googleusercontent.com/QS_YbPeZ0EDyZk91nSI6Bs1EEsxCvQK0WBG7fF6CicsMhjf0ELOESLTg_Ktl8YNUmM0",2.85,"2.8",N/A,true
"https://play.google.com/store/apps/details?id=com.gameworld.businessGame","com.gameworld.businessGame","Official <b> BUSINESS BOARD GAME : A online real-estate trading Board game </b><br><br>Do you want to become worlds best Business Game Tycoon?<br><br>Do you want to play king of board games ?<br><br><b>  Lets Play Classic board game with friends and family !! </b><br><br>In Business Game enjoy your business by sell and buy real-estate Properties such as builds houses, acquire monopolies, make deals, win auctions and jail.<br><br>Every city consist of different Monopoly and player have to own that for earn money.<br><br>Become a best Landlord king by own all house and hotels in city skylines!<br><br>Monoploy like Rent, House, Hotel, Buildings will be hidden in the business game.<br><br>In Business Game main important  is to learn business rules. By playing Business board game player earn money and become wealthiest.<br><br>In the Business Game, players roll two six-sided dice to move around the game board, buying and trading properties, and developing them with houses and hotels. Players collect rent from their opponents, with the goal being to drive them into bankruptcy. Money can also be gained or lost through Chance and Community Chest cards, and tax squares; players can end up in jail, which they cannot move from until they have met one of several conditions. <br>This Business Game is Addictive board game in which all  player focus on earn coin or money and become coin master !!<br><br>The player who owns properties has a which allowed to build houses and increase the rent. During playing this game, players experience ups and downs, rewards, losses and penalties etc.<br><br>When player roll dice and lands on Real-estate properties which not already owned, he may buy it from bank otherwise he has to pay rent to the owner of that place or site.<br><br>During financial crises, properties can be mortgaged to the bank.<br><br>In Business Board game Player&#39;s goal will be become rich and power full businessman by earning rent of all properties.<br><br>This is a Tabletop online Board game, which you can play online and offline with your friends and family. In this online board  game you can invite your friends by sms or email. just send room code to them and enjoy playing this online multiplayer game.<br><br>This game is a battle for billionaire tycoon and king of board games !!<br><br>Do you like to play board games such as Carrom game, Ludo, Chess game, you would also love &quot;Business Board Game&quot;.<br><br>*** Please play on Best WiFi connection to avoid connection problems ***<br><br>Please give us good rate to make our game as TOP business game.<br>send your feedback and idea on gameworld.zone.2017@gmail.com","Business Board","gameworld.zone",N/A,"https://play-lh.googleusercontent.com/aQnNq1p7MDwrn9NzBMHH7r3KhLDbr8eCHjhUJ45-xt_sDQZOIQ3J46AftgCSrr6_1ks",3.5679011,"3.6",N/A,true
